"No.","Time","Source","Destination","Protocol","Length","Info"
"1","0.000000000","10.0.0.1","10.0.0.2","TCP","74","34382  >  34567 [SYN] Seq=0 Win=42340 Len=0 MSS=1460 SACK_PERM=1 TSval=3528853320 TSecr=0 WS=512"
"2","0.151576204","10.0.0.2","10.0.0.1","TCP","74","34567  >  34382 [SYN, ACK] Seq=0 Ack=1 Win=43440 Len=0 MSS=1460 SACK_PERM=1 TSval=937261159 TSecr=3528853320 WS=512"
"3","0.202239984","10.0.0.1","10.0.0.2","TCP","66","34382  >  34567 [ACK] Seq=1 Ack=1 Win=42496 Len=0 TSval=3528853523 TSecr=937261159"
"4","0.226478629","10.0.0.1","10.0.0.2","TCP","2962","34382  >  34567 [PSH, ACK] Seq=1 Ack=1 Win=42496 Len=2896 TSval=3528853523 TSecr=937261159"
"5","0.250681661","10.0.0.1","10.0.0.2","TCP","2962","34382  >  34567 [PSH, ACK] Seq=2897 Ack=1 Win=42496 Len=2896 TSval=3528853523 TSecr=937261159"
"6","0.275179483","10.0.0.1","10.0.0.2","TCP","2962","34382  >  34567 [PSH, ACK] Seq=5793 Ack=1 Win=42496 Len=2896 TSval=3528853523 TSecr=937261159"
"7","0.299089748","10.0.0.1","10.0.0.2","TCP","2962","34382  >  34567 [PSH, ACK] Seq=8689 Ack=1 Win=42496 Len=2896 TSval=3528853523 TSecr=937261159"
"8","0.323454379","10.0.0.1","10.0.0.2","TCP","2962","34382  >  34567 [PSH, ACK] Seq=11585 Ack=1 Win=42496 Len=2896 TSval=3528853523 TSecr=937261159"
"9","0.377403559","10.0.0.2","10.0.0.1","TCP","66","34567  >  34382 [ACK] Seq=1 Ack=2897 Win=41984 Len=0 TSval=937261385 TSecr=3528853523"
"10","0.401746268","10.0.0.2","10.0.0.1","TCP","66","34567  >  34382 [ACK] Seq=1 Ack=5793 Win=41984 Len=0 TSval=937261409 TSecr=3528853523"
"11","0.425536757","10.0.0.2","10.0.0.1","TCP","66","34567  >  34382 [ACK] Seq=1 Ack=8689 Win=41984 Len=0 TSval=937261433 TSecr=3528853523"
"12","0.450350409","10.0.0.2","10.0.0.1","TCP","66","34567  >  34382 [ACK] Seq=1 Ack=11585 Win=41984 Len=0 TSval=937261457 TSecr=3528853523"
"13","0.452275700","10.0.0.1","10.0.0.2","TCP","2962","34382  >  34567 [PSH, ACK] Seq=14481 Ack=1 Win=42496 Len=2896 TSval=3528853748 TSecr=937261385"
"14","0.475149267","10.0.0.2","10.0.0.1","TCP","66","34567  >  34382 [ACK] Seq=1 Ack=14481 Win=41984 Len=0 TSval=937261482 TSecr=3528853523"
"15","0.476406805","10.0.0.1","10.0.0.2","TCP","2962","34382  >  34567 [PSH, ACK] Seq=17377 Ack=1 Win=42496 Len=2896 TSval=3528853773 TSecr=937261409"
"16","0.500942978","10.0.0.1","10.0.0.2","TCP","2962","34382  >  34567 [PSH, ACK] Seq=20273 Ack=1 Win=42496 Len=2896 TSval=3528853797 TSecr=937261433"
"17","0.524649908","10.0.0.1","10.0.0.2","TCP","2962","34382  >  34567 [PSH, ACK] Seq=23169 Ack=1 Win=42496 Len=2896 TSval=3528853821 TSecr=937261457"
"18","0.549554298","10.0.0.1","10.0.0.2","TCP","2962","34382  >  34567 [PSH, ACK] Seq=26065 Ack=1 Win=42496 Len=2896 TSval=3528853846 TSecr=937261482"
"19","0.603457287","10.0.0.2","10.0.0.1","TCP","66","34567  >  34382 [ACK] Seq=1 Ack=17377 Win=41984 Len=0 TSval=937261611 TSecr=3528853748"
"20","0.627736516","10.0.0.2","10.0.0.1","TCP","66","34567  >  34382 [ACK] Seq=1 Ack=20273 Win=48128 Len=0 TSval=937261634 TSecr=3528853773"
"21","0.652383467","10.0.0.2","10.0.0.1","TCP","66","34567  >  34382 [ACK] Seq=1 Ack=23169 Win=54272 Len=0 TSval=937261659 TSecr=3528853797"
"22","0.676202257","10.0.0.2","10.0.0.1","TCP","66","34567  >  34382 [ACK] Seq=1 Ack=26065 Win=59904 Len=0 TSval=937261683 TSecr=3528853821"
"23","0.678015635","10.0.0.1","10.0.0.2","TCP","2962","34382  >  34567 [PSH, ACK] Seq=28961 Ack=1 Win=42496 Len=2896 TSval=3528853974 TSecr=937261611"
"24","0.701867641","10.0.0.2","10.0.0.1","TCP","66","34567  >  34382 [ACK] Seq=1 Ack=28961 Win=65536 Len=0 TSval=937261708 TSecr=3528853846"
"25","0.702278970","10.0.0.1","10.0.0.2","TCP","2962","34382  >  34567 [PSH, ACK] Seq=31857 Ack=1 Win=42496 Len=2896 TSval=3528853999 TSecr=937261634"
"26","0.715437662","10.0.0.1","10.0.0.2","TCP","1514","34382  >  34567 [ACK] Seq=34753 Ack=1 Win=42496 Len=1448 TSval=3528854023 TSecr=937261659"
"27","0.751159488","10.0.0.1","10.0.0.2","TCP","2962","34382  >  34567 [PSH, ACK] Seq=36201 Ack=1 Win=42496 Len=2896 TSval=3528854047 TSecr=937261683"
"28","0.776279020","10.0.0.1","10.0.0.2","TCP","2962","[TCP Previous segment not captured] 34382  >  34567 [PSH, ACK] Seq=41993 Ack=1 Win=42496 Len=2896 TSval=3528854073 TSecr=937261708"
"29","0.829181337","10.0.0.2","10.0.0.1","TCP","66","34567  >  34382 [ACK] Seq=1 Ack=31857 Win=71680 Len=0 TSval=937261837 TSecr=3528853974"
"30","0.856317638","10.0.0.2","10.0.0.1","TCP","66","34567  >  34382 [ACK] Seq=1 Ack=34753 Win=77312 Len=0 TSval=937261860 TSecr=3528853999"
"31","0.866079237","10.0.0.2","10.0.0.1","TCP","66","34567  >  34382 [ACK] Seq=1 Ack=36201 Win=80384 Len=0 TSval=937261874 TSecr=3528854023"
"32","0.905509588","10.0.0.2","10.0.0.1","TCP","66","34567  >  34382 [ACK] Seq=1 Ack=39097 Win=80384 Len=0 TSval=937261910 TSecr=3528854047"
"33","0.927011154","10.0.0.2","10.0.0.1","TCP","78","[TCP Dup ACK 32#1] 34567  >  34382 [ACK] Seq=1 Ack=39097 Win=80384 Len=0 TSval=937261934 TSecr=3528854047 SLE=41993 SRE=44889"
"34","0.930781177","10.0.0.1","10.0.0.2","TCP","2962","[TCP Previous segment not captured] 34382  >  34567 [PSH, ACK] Seq=47785 Ack=1 Win=42496 Len=2896 TSval=3528854227 TSecr=937261860"
"35","0.942763010","10.0.0.1","10.0.0.2","TCP","1514","34382  >  34567 [ACK] Seq=50681 Ack=1 Win=42496 Len=1448 TSval=3528854237 TSecr=937261874"
"36","0.979981318","10.0.0.1","10.0.0.2","TCP","2962","34382  >  34567 [PSH, ACK] Seq=52129 Ack=1 Win=42496 Len=2896 TSval=3528854277 TSecr=937261910"
"37","1.004207125","10.0.0.1","10.0.0.2","TCP","2962","34382  >  34567 [PSH, ACK] Seq=55025 Ack=1 Win=42496 Len=2896 TSval=3528854298 TSecr=937261934"
"38","1.054054377","10.0.0.1","10.0.0.2","TCP","1514","[TCP Out-Of-Order] 34382  >  34567 [ACK] Seq=39097 Ack=1 Win=42496 Len=1448 TSval=3528854363 TSecr=937261934"
"39","1.081258785","10.0.0.2","10.0.0.1","TCP","86","[TCP Dup ACK 32#2] 34567  >  34382 [ACK] Seq=1 Ack=39097 Win=80384 Len=0 TSval=937262089 TSecr=3528854047 SLE=47785 SRE=50681 SLE=41993 SRE=44889"
"40","1.094718641","10.0.0.2","10.0.0.1","TCP","86","[TCP Dup ACK 32#3] 34567  >  34382 [ACK] Seq=1 Ack=39097 Win=80384 Len=0 TSval=937262101 TSecr=3528854047 SLE=47785 SRE=52129 SLE=41993 SRE=44889"
"41","1.131481424","10.0.0.2","10.0.0.1","TCP","86","[TCP Dup ACK 32#4] 34567  >  34382 [ACK] Seq=1 Ack=39097 Win=80384 Len=0 TSval=937262138 TSecr=3528854047 SLE=47785 SRE=55025 SLE=41993 SRE=44889"
"42","1.143770124","10.0.0.1","10.0.0.2","TCP","1514","[TCP Out-Of-Order] 34382  >  34567 [ACK] Seq=40545 Ack=1 Win=42496 Len=1448 TSval=3528854452 TSecr=937262089"
"43","1.155052981","10.0.0.2","10.0.0.1","TCP","86","[TCP Dup ACK 32#5] 34567  >  34382 [ACK] Seq=1 Ack=39097 Win=80384 Len=0 TSval=937262162 TSecr=3528854047 SLE=47785 SRE=57921 SLE=41993 SRE=44889"
"44","1.157062490","10.0.0.1","10.0.0.2","TCP","1514","[TCP Out-Of-Order] 34382  >  34567 [ACK] Seq=44889 Ack=1 Win=42496 Len=1448 TSval=3528854466 TSecr=937262101"
"45","1.194270380","10.0.0.1","10.0.0.2","TCP","1514","[TCP Out-Of-Order] 34382  >  34567 [ACK] Seq=46337 Ack=1 Win=42496 Len=1448 TSval=3528854502 TSecr=937262138"
"46","1.205573702","10.0.0.2","10.0.0.1","TCP","86","34567  >  34382 [ACK] Seq=1 Ack=40545 Win=79360 Len=0 TSval=937262212 TSecr=3528854363 SLE=47785 SRE=57921 SLE=41993 SRE=44889"
"47","1.205874094","10.0.0.1","10.0.0.2","TCP","1514","34382  >  34567 [ACK] Seq=57921 Ack=1 Win=42496 Len=1448 TSval=3528854502 TSecr=937262138"
"48","1.230044167","10.0.0.1","10.0.0.2","TCP","2962","34382  >  34567 [PSH, ACK] Seq=59369 Ack=1 Win=42496 Len=2896 TSval=3528854526 TSecr=937262162"
"49","1.268300408","10.0.0.1","10.0.0.2","TCP","1514","34382  >  34567 [ACK] Seq=62265 Ack=1 Win=42496 Len=1448 TSval=3528854577 TSecr=937262212"
"50","1.295355436","10.0.0.2","10.0.0.1","TCP","78","34567  >  34382 [ACK] Seq=1 Ack=44889 Win=75264 Len=0 TSval=937262302 TSecr=3528854452 SLE=47785 SRE=57921"
"51","1.308864540","10.0.0.2","10.0.0.1","TCP","78","34567  >  34382 [ACK] Seq=1 Ack=46337 Win=74240 Len=0 TSval=937262316 TSecr=3528854466 SLE=47785 SRE=57921"
"52","1.345413733","10.0.0.2","10.0.0.1","TCP","66","34567  >  34382 [ACK] Seq=1 Ack=57921 Win=75264 Len=0 TSval=937262353 TSecr=3528854502"
"53","1.357739608","10.0.0.1","10.0.0.2","TCP","1514","34382  >  34567 [ACK] Seq=63713 Ack=1 Win=42496 Len=1448 TSval=3528854666 TSecr=937262302"
"54","1.371194862","10.0.0.1","10.0.0.2","TCP","1514","34382  >  34567 [ACK] Seq=65161 Ack=1 Win=42496 Len=1448 TSval=3528854680 TSecr=937262316"
"55","1.380682935","10.0.0.2","10.0.0.1","TCP","66","34567  >  34382 [ACK] Seq=1 Ack=62265 Win=80384 Len=0 TSval=937262388 TSecr=3528854502"
"56","1.407749219","10.0.0.1","10.0.0.2","TCP","1514","34382  >  34567 [ACK] Seq=66609 Ack=1 Win=42496 Len=1448 TSval=3528854716 TSecr=937262353"
"57","1.455354226","10.0.0.1","10.0.0.2","TCP","2962","[TCP Previous segment not captured] 34382  >  34567 [PSH, ACK] Seq=70953 Ack=1 Win=42496 Len=2896 TSval=3528854752 TSecr=937262388"
"58","1.475936853","10.0.0.2","10.0.0.1","TCP","66","34567  >  34382 [ACK] Seq=1 Ack=63713 Win=82432 Len=0 TSval=937262483 TSecr=3528854577"
"59","1.523079751","10.0.0.2","10.0.0.1","TCP","66","34567  >  34382 [ACK] Seq=1 Ack=66609 Win=84992 Len=0 TSval=937262530 TSecr=3528854666"
"60","1.538705885","10.0.0.1","10.0.0.2","TCP","1514","34382  >  34567 [ACK] Seq=73849 Ack=1 Win=42496 Len=1448 TSval=3528854847 TSecr=937262483"
"61","1.559373785","10.0.0.2","10.0.0.1","TCP","66","34567  >  34382 [ACK] Seq=1 Ack=68057 Win=88064 Len=0 TSval=937262566 TSecr=3528854716"
"62","1.597497759","10.0.0.1","10.0.0.2","TCP","2962","34382  >  34567 [PSH, ACK] Seq=75297 Ack=1 Win=42496 Len=2896 TSval=3528854894 TSecr=937262530"
"63","1.606438252","10.0.0.2","10.0.0.1","TCP","78","[TCP Window Update] 34567  >  34382 [ACK] Seq=1 Ack=68057 Win=93696 Len=0 TSval=937262613 TSecr=3528854716 SLE=70953 SRE=73849"
"64","1.622155503","10.0.0.1","10.0.0.2","TCP","1514","34382  >  34567 [ACK] Seq=78193 Ack=1 Win=42496 Len=1448 TSval=3528854930 TSecr=937262566"
"65","1.669208738","10.0.0.1","10.0.0.2","TCP","1514","34382  >  34567 [ACK] Seq=79641 Ack=1 Win=42496 Len=1448 TSval=3528854977 TSecr=937262613"
"66","1.689929036","10.0.0.2","10.0.0.1","TCP","78","[TCP Window Update] 34567  >  34382 [ACK] Seq=1 Ack=68057 Win=96768 Len=0 TSval=937262697 TSecr=3528854716 SLE=70953 SRE=75297"
"67","1.729683690","10.0.0.1","10.0.0.2","TCP","1514","[TCP Out-Of-Order] 34382  >  34567 [ACK] Seq=68057 Ack=1 Win=42496 Len=1448 TSval=3528855038 TSecr=937262613"
"68","1.748803259","10.0.0.2","10.0.0.1","TCP","78","[TCP Window Update] 34567  >  34382 [ACK] Seq=1 Ack=68057 Win=102400 Len=0 TSval=937262756 TSecr=3528854716 SLE=70953 SRE=78193"
"69","1.774812279","10.0.0.2","10.0.0.1","TCP","78","[TCP Window Update] 34567  >  34382 [ACK] Seq=1 Ack=68057 Win=105472 Len=0 TSval=937262780 TSecr=3528854716 SLE=70953 SRE=79641"
"70","1.811541381","10.0.0.1","10.0.0.2","TCP","1514","[TCP Out-Of-Order] 34382  >  34567 [ACK] Seq=69505 Ack=1 Win=42496 Len=1448 TSval=3528855120 TSecr=937262756"
"71","1.820440435","10.0.0.2","10.0.0.1","TCP","78","[TCP Window Update] 34567  >  34382 [ACK] Seq=1 Ack=68057 Win=108544 Len=0 TSval=937262828 TSecr=3528854716 SLE=70953 SRE=81089"
"72","1.823741561","10.0.0.1","10.0.0.2","TCP","1514","34382  >  34567 [ACK] Seq=81089 Ack=1 Win=42496 Len=1448 TSval=3528855120 TSecr=937262756"
"73","1.837036159","10.0.0.1","10.0.0.2","TCP","1514","34382  >  34567 [ACK] Seq=82537 Ack=1 Win=42496 Len=1448 TSval=3528855146 TSecr=937262780"
"74","1.882810041","10.0.0.1","10.0.0.2","TCP","1514","34382  >  34567 [ACK] Seq=83985 Ack=1 Win=42496 Len=1448 TSval=3528855191 TSecr=937262828"
"75","1.883995068","10.0.0.2","10.0.0.1","TCP","78","34567  >  34382 [ACK] Seq=1 Ack=69505 Win=111104 Len=0 TSval=937262888 TSecr=3528855038 SLE=70953 SRE=81089"
"76","1.946258555","10.0.0.1","10.0.0.2","TCP","1514","34382  >  34567 [ACK] Seq=85433 Ack=1 Win=42496 Len=1448 TSval=3528855255 TSecr=937262888"
"77","1.962176860","10.0.0.2","10.0.0.1","TCP","66","34567  >  34382 [ACK] Seq=1 Ack=81089 Win=114176 Len=0 TSval=937262970 TSecr=3528855120"
"78","1.974406587","10.0.0.2","10.0.0.1","TCP","66","34567  >  34382 [ACK] Seq=1 Ack=82537 Win=117248 Len=0 TSval=937262982 TSecr=3528855120"
"79","1.987606603","10.0.0.2","10.0.0.1","TCP","66","34567  >  34382 [ACK] Seq=1 Ack=83985 Win=119808 Len=0 TSval=937262995 TSecr=3528855146"
"80","2.025003862","10.0.0.1","10.0.0.2","TCP","1514","34382  >  34567 [ACK] Seq=86881 Ack=1 Win=42496 Len=1448 TSval=3528855333 TSecr=937262970"
"81","2.034379605","10.0.0.2","10.0.0.1","TCP","66","34567  >  34382 [ACK] Seq=1 Ack=85433 Win=122880 Len=0 TSval=937263041 TSecr=3528855191"
"82","2.036566351","10.0.0.1","10.0.0.2","TCP","1514","34382  >  34567 [ACK] Seq=88329 Ack=1 Win=42496 Len=1448 TSval=3528855345 TSecr=937262982"
"83","2.097136940","10.0.0.1","10.0.0.2","TCP","1514","[TCP Previous segment not captured] 34382  >  34567 [ACK] Seq=91225 Ack=1 Win=42496 Len=1448 TSval=3528855405 TSecr=937263041"
"84","2.097144354","10.0.0.2","10.0.0.1","TCP","66","34567  >  34382 [ACK] Seq=1 Ack=86881 Win=125952 Len=0 TSval=937263104 TSecr=3528855255"
"85","2.172222464","10.0.0.1","10.0.0.2","TCP","2962","34382  >  34567 [PSH, ACK] Seq=92673 Ack=1 Win=42496 Len=2896 TSval=3528855468 TSecr=937263104"
"86","2.175307264","10.0.0.2","10.0.0.1","TCP","66","34567  >  34382 [ACK] Seq=1 Ack=88329 Win=128512 Len=0 TSval=937263183 TSecr=3528855333"
"87","2.187479531","10.0.0.2","10.0.0.1","TCP","66","34567  >  34382 [ACK] Seq=1 Ack=89777 Win=131584 Len=0 TSval=937263195 TSecr=3528855345"
"88","2.237603320","10.0.0.1","10.0.0.2","TCP","1514","34382  >  34567 [ACK] Seq=95569 Ack=1 Win=42496 Len=1448 TSval=3528855546 TSecr=937263183"
"89","2.248858162","10.0.0.2","10.0.0.1","TCP","78","[TCP Window Update] 34567  >  34382 [ACK] Seq=1 Ack=89777 Win=134656 Len=0 TSval=937263256 TSecr=3528855345 SLE=91225 SRE=92673"
"90","2.249651737","10.0.0.1","10.0.0.2","TCP","1514","34382  >  34567 [ACK] Seq=97017 Ack=1 Win=42496 Len=1448 TSval=3528855558 TSecr=937263195"
"91","2.311042632","10.0.0.1","10.0.0.2","TCP","1514","34382  >  34567 [ACK] Seq=98465 Ack=1 Win=42496 Len=1448 TSval=3528855620 TSecr=937263256"
"92","2.323699217","10.0.0.2","10.0.0.1","TCP","78","[TCP Dup ACK 87#1] 34567  >  34382 [ACK] Seq=1 Ack=89777 Win=134656 Len=0 TSval=937263331 TSecr=3528855345 SLE=91225 SRE=95569"
"93","2.325707824","10.0.0.1","10.0.0.2","TCP","1514","[TCP Out-Of-Order] 34382  >  34567 [ACK] Seq=89777 Ack=1 Win=42496 Len=1448 TSval=3528855634 TSecr=937263256"
"94","2.393182790","10.0.0.2","10.0.0.1","TCP","78","[TCP Dup ACK 87#2] 34567  >  34382 [ACK] Seq=1 Ack=89777 Win=134656 Len=0 TSval=937263400 TSecr=3528855345 SLE=91225 SRE=97017"
"95","2.404768952","10.0.0.2","10.0.0.1","TCP","78","[TCP Dup ACK 87#3] 34567  >  34382 [ACK] Seq=1 Ack=89777 Win=134656 Len=0 TSval=937263412 TSecr=3528855345 SLE=91225 SRE=98465"
"96","2.455605154","10.0.0.1","10.0.0.2","TCP","1514","34382  >  34567 [ACK] Seq=99913 Ack=1 Win=42496 Len=1448 TSval=3528855764 TSecr=937263400"
"97","2.463707620","10.0.0.2","10.0.0.1","TCP","78","[TCP Dup ACK 87#4] 34567  >  34382 [ACK] Seq=1 Ack=89777 Win=134656 Len=0 TSval=937263469 TSecr=3528855345 SLE=91225 SRE=99913"
"98","2.467641569","10.0.0.1","10.0.0.2","TCP","1514","34382  >  34567 [ACK] Seq=101361 Ack=1 Win=42496 Len=1448 TSval=3528855776 TSecr=937263412"
"99","2.476144043","10.0.0.2","10.0.0.1","TCP","66","34567  >  34382 [ACK] Seq=1 Ack=99913 Win=129536 Len=0 TSval=937263484 TSecr=3528855634"
"100","2.526994121","10.0.0.1","10.0.0.2","TCP","1514","34382  >  34567 [ACK] Seq=102809 Ack=1 Win=42496 Len=1448 TSval=3528855835 TSecr=937263469"
"101","2.539236395","10.0.0.1","10.0.0.2","TCP","1514","34382  >  34567 [ACK] Seq=104257 Ack=1 Win=42496 Len=1448 TSval=3528855847 TSecr=937263484"
"102","2.633938254","10.0.0.2","10.0.0.1","TCP","66","34567  >  34382 [ACK] Seq=1 Ack=102809 Win=134656 Len=0 TSval=937263641 TSecr=3528855764"
"103","2.709036588","10.0.0.1","10.0.0.2","TCP","2962","34382  >  34567 [PSH, ACK] Seq=105705 Ack=1 Win=42496 Len=2896 TSval=3528856005 TSecr=937263641"
"104","2.742009335","10.0.0.2","10.0.0.1","TCP","66","34567  >  34382 [ACK] Seq=1 Ack=105705 Win=134656 Len=0 TSval=937263750 TSecr=3528855835"
"105","2.816349639","10.0.0.1","10.0.0.2","TCP","2962","34382  >  34567 [PSH, ACK] Seq=108601 Ack=1 Win=42496 Len=2896 TSval=3528856113 TSecr=937263750"
"106","2.829152173","10.0.0.1","10.0.0.2","TCP","1514","34382  >  34567 [ACK] Seq=111497 Ack=1 Win=42496 Len=1448 TSval=3528856113 TSecr=937263750"
"107","2.912018307","10.0.0.2","10.0.0.1","TCP","66","34567  >  34382 [ACK] Seq=1 Ack=108601 Win=134656 Len=0 TSval=937263920 TSecr=3528856005"
"108","2.986546957","10.0.0.1","10.0.0.2","TCP","2962","34382  >  34567 [PSH, ACK] Seq=112945 Ack=1 Win=42496 Len=2896 TSval=3528856283 TSecr=937263920"
"109","3.057591865","10.0.0.2","10.0.0.1","TCP","66","34567  >  34382 [ACK] Seq=1 Ack=111497 Win=134656 Len=0 TSval=937264065 TSecr=3528856113"
"110","3.131935864","10.0.0.1","10.0.0.2","TCP","2962","34382  >  34567 [PSH, ACK] Seq=115841 Ack=1 Win=42496 Len=2896 TSval=3528856429 TSecr=937264065"
"111","3.135784052","10.0.0.2","10.0.0.1","TCP","66","34567  >  34382 [ACK] Seq=1 Ack=112945 Win=134656 Len=0 TSval=937264143 TSecr=3528856113"
"112","3.210498910","10.0.0.1","10.0.0.2","TCP","2962","34382  >  34567 [PSH, ACK] Seq=118737 Ack=1 Win=42496 Len=2896 TSval=3528856507 TSecr=937264143"
"113","3.251652300","10.0.0.2","10.0.0.1","TCP","66","34567  >  34382 [ACK] Seq=1 Ack=115841 Win=134656 Len=0 TSval=937264258 TSecr=3528856283"
"114","3.313898833","10.0.0.1","10.0.0.2","TCP","1514","34382  >  34567 [ACK] Seq=121633 Ack=1 Win=42496 Len=1448 TSval=3528856623 TSecr=937264258"
"115","3.432917654","10.0.0.2","10.0.0.1","TCP","66","34567  >  34382 [ACK] Seq=1 Ack=118737 Win=134656 Len=0 TSval=937264440 TSecr=3528856429"
"116","3.507252260","10.0.0.1","10.0.0.2","TCP","2962","34382  >  34567 [PSH, ACK] Seq=123081 Ack=1 Win=42496 Len=2896 TSval=3528856804 TSecr=937264440"
"117","3.527298355","10.0.0.2","10.0.0.1","TCP","66","34567  >  34382 [ACK] Seq=1 Ack=121633 Win=134656 Len=0 TSval=937264528 TSecr=3528856507"
"118","3.601753323","10.0.0.1","10.0.0.2","TCP","2962","34382  >  34567 [PSH, ACK] Seq=125977 Ack=1 Win=42496 Len=2896 TSval=3528856898 TSecr=937264528"
"119","3.804960997","10.0.0.2","10.0.0.1","TCP","66","34567  >  34382 [ACK] Seq=1 Ack=123081 Win=134656 Len=0 TSval=937264811 TSecr=3528856623"
"120","3.868451890","10.0.0.2","10.0.0.1","TCP","66","34567  >  34382 [ACK] Seq=1 Ack=125977 Win=134656 Len=0 TSval=937264876 TSecr=3528856804"
"121","3.879319977","10.0.0.1","10.0.0.2","TCP","2962","34382  >  34567 [PSH, ACK] Seq=128873 Ack=1 Win=42496 Len=2896 TSval=3528857176 TSecr=937264811"
"122","3.942765025","10.0.0.1","10.0.0.2","TCP","2962","34382  >  34567 [PSH, ACK] Seq=131769 Ack=1 Win=42496 Len=2896 TSval=3528857239 TSecr=937264876"
"123","3.989638268","10.0.0.2","10.0.0.1","TCP","66","34567  >  34382 [ACK] Seq=1 Ack=128873 Win=134656 Len=0 TSval=937264997 TSecr=3528856898"
"124","4.064029746","10.0.0.1","10.0.0.2","TCP","2962","34382  >  34567 [PSH, ACK] Seq=134665 Ack=1 Win=42496 Len=2896 TSval=3528857361 TSecr=937264997"
"125","4.268044863","10.0.0.2","10.0.0.1","TCP","66","34567  >  34382 [ACK] Seq=1 Ack=131769 Win=134656 Len=0 TSval=937265276 TSecr=3528857176"
"126","4.342657661","10.0.0.1","10.0.0.2","TCP","2962","34382  >  34567 [PSH, ACK] Seq=137561 Ack=1 Win=42496 Len=2896 TSval=3528857639 TSecr=937265276"
"127","4.365202822","10.0.0.2","10.0.0.1","TCP","66","34567  >  34382 [ACK] Seq=1 Ack=134665 Win=134656 Len=0 TSval=937265373 TSecr=3528857239"
"128","4.439525335","10.0.0.1","10.0.0.2","TCP","2962","34382  >  34567 [PSH, ACK] Seq=140457 Ack=1 Win=42496 Len=2896 TSval=3528857736 TSecr=937265373"
"129","4.513200792","10.0.0.2","10.0.0.1","TCP","66","34567  >  34382 [ACK] Seq=1 Ack=137561 Win=134656 Len=0 TSval=937265521 TSecr=3528857361"
"130","4.588997840","10.0.0.1","10.0.0.2","TCP","2962","34382  >  34567 [PSH, ACK] Seq=143353 Ack=1 Win=42496 Len=2896 TSval=3528857884 TSecr=937265521"
"131","4.814387191","10.0.0.2","10.0.0.1","TCP","66","34567  >  34382 [ACK] Seq=1 Ack=140457 Win=134656 Len=0 TSval=937265821 TSecr=3528857639"
"132","4.888749828","10.0.0.1","10.0.0.2","TCP","2962","34382  >  34567 [PSH, ACK] Seq=146249 Ack=1 Win=42496 Len=2896 TSval=3528858185 TSecr=937265821"
"133","4.934310651","10.0.0.2","10.0.0.1","TCP","66","34567  >  34382 [ACK] Seq=1 Ack=143353 Win=134656 Len=0 TSval=937265942 TSecr=3528857736"
"134","5.009092673","10.0.0.1","10.0.0.2","TCP","2962","34382  >  34567 [PSH, ACK] Seq=149145 Ack=1 Win=42496 Len=2896 TSval=3528858305 TSecr=937265942"
"135","5.091938339","10.0.0.2","10.0.0.1","TCP","66","34567  >  34382 [ACK] Seq=1 Ack=146249 Win=134656 Len=0 TSval=937266099 TSecr=3528857884"
"136","5.166301558","10.0.0.1","10.0.0.2","TCP","2962","34382  >  34567 [PSH, ACK] Seq=152041 Ack=1 Win=42496 Len=2896 TSval=3528858463 TSecr=937266099"
"137","5.407117403","10.0.0.2","10.0.0.1","TCP","66","34567  >  34382 [ACK] Seq=1 Ack=149145 Win=134656 Len=0 TSval=937266414 TSecr=3528858185"
"138","5.481465779","10.0.0.1","10.0.0.2","TCP","2962","34382  >  34567 [PSH, ACK] Seq=154937 Ack=1 Win=42496 Len=2896 TSval=3528858778 TSecr=937266414"
"139","5.529333392","10.0.0.2","10.0.0.1","TCP","66","34567  >  34382 [ACK] Seq=1 Ack=152041 Win=134656 Len=0 TSval=937266536 TSecr=3528858305"
"140","5.603996581","10.0.0.1","10.0.0.2","TCP","2962","34382  >  34567 [PSH, ACK] Seq=157833 Ack=1 Win=42496 Len=2896 TSval=3528858900 TSecr=937266536"
"141","5.685732720","10.0.0.2","10.0.0.1","TCP","66","34567  >  34382 [ACK] Seq=1 Ack=154937 Win=134656 Len=0 TSval=937266693 TSecr=3528858463"
"142","5.760704924","10.0.0.1","10.0.0.2","TCP","2962","34382  >  34567 [PSH, ACK] Seq=160729 Ack=1 Win=42496 Len=2896 TSval=3528859057 TSecr=937266693"
"143","6.029628480","10.0.0.2","10.0.0.1","TCP","66","34567  >  34382 [ACK] Seq=1 Ack=157833 Win=134656 Len=0 TSval=937267033 TSecr=3528858778"
"144","6.104215638","10.0.0.1","10.0.0.2","TCP","2962","34382  >  34567 [PSH, ACK] Seq=163625 Ack=1 Win=42496 Len=2896 TSval=3528859401 TSecr=937267033"
"145","6.128236119","10.0.0.1","10.0.0.2","TCP","2962","34382  >  34567 [PSH, ACK] Seq=166521 Ack=1 Win=42496 Len=2896 TSval=3528859401 TSecr=937267033"
"146","6.145999186","10.0.0.2","10.0.0.1","TCP","66","34567  >  34382 [ACK] Seq=1 Ack=160729 Win=134656 Len=0 TSval=937267153 TSecr=3528858900"
"147","6.220275212","10.0.0.1","10.0.0.2","TCP","2962","34382  >  34567 [PSH, ACK] Seq=169417 Ack=1 Win=42496 Len=2896 TSval=3528859517 TSecr=937267153"
"148","6.303531393","10.0.0.2","10.0.0.1","TCP","66","34567  >  34382 [ACK] Seq=1 Ack=163625 Win=134656 Len=0 TSval=937267311 TSecr=3528859057"
"149","6.669336055","10.0.0.2","10.0.0.1","TCP","66","34567  >  34382 [ACK] Seq=1 Ack=166521 Win=134656 Len=0 TSval=937267674 TSecr=3528859401"
"150","6.719495955","10.0.0.2","10.0.0.1","TCP","66","34567  >  34382 [ACK] Seq=1 Ack=169417 Win=134656 Len=0 TSval=937267727 TSecr=3528859401"
"151","6.744494016","10.0.0.1","10.0.0.2","TCP","2962","[TCP Previous segment not captured] 34382  >  34567 [PSH, ACK] Seq=175209 Ack=1 Win=42496 Len=2896 TSval=3528860040 TSecr=937267674"
"152","6.767962851","10.0.0.1","10.0.0.2","TCP","2962","34382  >  34567 [PSH, ACK] Seq=178105 Ack=1 Win=42496 Len=2896 TSval=3528860040 TSecr=937267674"
"153","6.795009386","10.0.0.1","10.0.0.2","TCP","2962","34382  >  34567 [PSH, ACK] Seq=181001 Ack=1 Win=42496 Len=2896 TSval=3528860090 TSecr=937267727"
"154","6.811547034","10.0.0.2","10.0.0.1","TCP","66","34567  >  34382 [ACK] Seq=1 Ack=172313 Win=134656 Len=0 TSval=937267819 TSecr=3528859517"
"155","6.885942383","10.0.0.1","10.0.0.2","TCP","2962","34382  >  34567 [PSH, ACK] Seq=183897 Ack=1 Win=42496 Len=2896 TSval=3528860183 TSecr=937267819"
"156","6.910211618","10.0.0.1","10.0.0.2","TCP","2962","34382  >  34567 [PSH, ACK] Seq=186793 Ack=1 Win=42496 Len=2896 TSval=3528860183 TSecr=937267819"
"157","7.233650004","10.0.0.2","10.0.0.1","TCP","78","[TCP Dup ACK 154#1] 34567  >  34382 [ACK] Seq=1 Ack=172313 Win=134656 Len=0 TSval=937268241 TSecr=3528859517 SLE=175209 SRE=178105"
"158","7.257212227","10.0.0.2","10.0.0.1","TCP","78","[TCP Dup ACK 154#2] 34567  >  34382 [ACK] Seq=1 Ack=172313 Win=134656 Len=0 TSval=937268265 TSecr=3528859517 SLE=175209 SRE=181001"
"159","7.282145826","10.0.0.2","10.0.0.1","TCP","78","[TCP Dup ACK 154#3] 34567  >  34382 [ACK] Seq=1 Ack=172313 Win=134656 Len=0 TSval=937268289 TSecr=3528859517 SLE=175209 SRE=183897"
"160","7.295937925","10.0.0.1","10.0.0.2","TCP","1514","[TCP Fast Retransmission] 34382  >  34567 [ACK] Seq=172313 Ack=1 Win=42496 Len=1448 TSval=3528860605 TSecr=937268241"
"161","7.307003643","10.0.0.2","10.0.0.1","TCP","78","[TCP Dup ACK 154#4] 34567  >  34382 [ACK] Seq=1 Ack=172313 Win=134656 Len=0 TSval=937268313 TSecr=3528859517 SLE=175209 SRE=186793"
"162","7.319438052","10.0.0.1","10.0.0.2","TCP","1514","[TCP Retransmission] 34382  >  34567 [ACK] Seq=173761 Ack=1 Win=42496 Len=1448 TSval=3528860628 TSecr=937268265"
"163","7.331929648","10.0.0.1","10.0.0.2","TCP","1514","34382  >  34567 [ACK] Seq=189689 Ack=1 Win=42496 Len=1448 TSval=3528860628 TSecr=937268265"
"164","7.332223167","10.0.0.2","10.0.0.1","TCP","78","[TCP Dup ACK 154#5] 34567  >  34382 [ACK] Seq=1 Ack=172313 Win=134656 Len=0 TSval=937268338 TSecr=3528859517 SLE=175209 SRE=189689"
"165","7.356638736","10.0.0.1","10.0.0.2","TCP","2962","34382  >  34567 [PSH, ACK] Seq=191137 Ack=1 Win=42496 Len=2896 TSval=3528860653 TSecr=937268289"
"166","7.382409009","10.0.0.1","10.0.0.2","TCP","2962","34382  >  34567 [PSH, ACK] Seq=194033 Ack=1 Win=42496 Len=2896 TSval=3528860678 TSecr=937268313"
"167","7.406810352","10.0.0.1","10.0.0.2","TCP","2962","34382  >  34567 [PSH, ACK] Seq=196929 Ack=1 Win=42496 Len=2896 TSval=3528860703 TSecr=937268338"
"168","7.447189993","10.0.0.2","10.0.0.1","TCP","78","34567  >  34382 [ACK] Seq=1 Ack=173761 Win=133632 Len=0 TSval=937268454 TSecr=3528860605 SLE=175209 SRE=189689"
"169","7.470725846","10.0.0.2","10.0.0.1","TCP","66","34567  >  34382 [ACK] Seq=1 Ack=189689 Win=126976 Len=0 TSval=937268478 TSecr=3528860628"
"170","7.508096349","10.0.0.2","10.0.0.1","TCP","66","34567  >  34382 [ACK] Seq=1 Ack=194033 Win=134144 Len=0 TSval=937268515 TSecr=3528860628"
"171","7.509418863","10.0.0.1","10.0.0.2","TCP","1514","34382  >  34567 [ACK] Seq=199825 Ack=1 Win=42496 Len=1448 TSval=3528860818 TSecr=937268454"
"172","7.535210097","10.0.0.1","10.0.0.2","TCP","1514","34382  >  34567 [ACK] Seq=201273 Ack=1 Win=42496 Len=1448 TSval=3528860842 TSecr=937268478"
"173","7.535217190","10.0.0.2","10.0.0.1","TCP","66","34567  >  34382 [ACK] Seq=1 Ack=196929 Win=134144 Len=0 TSval=937268541 TSecr=3528860678"
"174","7.558290749","10.0.0.2","10.0.0.1","TCP","66","34567  >  34382 [ACK] Seq=1 Ack=199825 Win=134144 Len=0 TSval=937268565 TSecr=3528860703"
"175","7.582439741","10.0.0.1","10.0.0.2","TCP","2962","34382  >  34567 [PSH, ACK] Seq=202721 Ack=1 Win=42496 Len=2896 TSval=3528860879 TSecr=937268515"
"176","7.606904623","10.0.0.1","10.0.0.2","TCP","2962","34382  >  34567 [PSH, ACK] Seq=205617 Ack=1 Win=42496 Len=2896 TSval=3528860879 TSecr=937268515"
"177","7.631041541","10.0.0.1","10.0.0.2","TCP","2962","34382  >  34567 [PSH, ACK] Seq=208513 Ack=1 Win=42496 Len=2896 TSval=3528860906 TSecr=937268541"
"178","7.655130861","10.0.0.1","10.0.0.2","TCP","2962","34382  >  34567 [PSH, ACK] Seq=211409 Ack=1 Win=42496 Len=2896 TSval=3528860929 TSecr=937268565"
"179","7.686264127","10.0.0.2","10.0.0.1","TCP","66","34567  >  34382 [ACK] Seq=1 Ack=202721 Win=134656 Len=0 TSval=937268694 TSecr=3528860818"
"180","7.732835083","10.0.0.2","10.0.0.1","TCP","66","34567  >  34382 [ACK] Seq=1 Ack=205617 Win=136192 Len=0 TSval=937268741 TSecr=3528860879"
"181","7.757797976","10.0.0.2","10.0.0.1","TCP","66","34567  >  34382 [ACK] Seq=1 Ack=208513 Win=136192 Len=0 TSval=937268765 TSecr=3528860879"
"182","7.764274647","10.0.0.1","10.0.0.2","TCP","2962","34382  >  34567 [PSH, ACK] Seq=214305 Ack=1 Win=42496 Len=2896 TSval=3528861057 TSecr=937268694"
"183","7.781733584","10.0.0.2","10.0.0.1","TCP","66","34567  >  34382 [ACK] Seq=1 Ack=211409 Win=136192 Len=0 TSval=937268790 TSecr=3528860906"
"184","7.806081257","10.0.0.2","10.0.0.1","TCP","66","34567  >  34382 [ACK] Seq=1 Ack=214305 Win=141824 Len=0 TSval=937268814 TSecr=3528860929"
"185","7.807191774","10.0.0.1","10.0.0.2","TCP","2962","34382  >  34567 [PSH, ACK] Seq=217201 Ack=1 Win=42496 Len=2896 TSval=3528861104 TSecr=937268741"
"186","7.832119972","10.0.0.1","10.0.0.2","TCP","2962","34382  >  34567 [PSH, ACK] Seq=220097 Ack=1 Win=42496 Len=2896 TSval=3528861129 TSecr=937268765"
"187","7.857047821","10.0.0.1","10.0.0.2","TCP","2962","34382  >  34567 [PSH, ACK] Seq=222993 Ack=1 Win=42496 Len=2896 TSval=3528861153 TSecr=937268790"
"188","7.880569369","10.0.0.1","10.0.0.2","TCP","2962","34382  >  34567 [PSH, ACK] Seq=225889 Ack=1 Win=42496 Len=2896 TSval=3528861177 TSecr=937268814"
"189","7.892790690","10.0.0.1","10.0.0.2","TCP","1514","34382  >  34567 [ACK] Seq=228785 Ack=1 Win=42496 Len=1448 TSval=3528861177 TSecr=937268814"
"190","7.914945975","10.0.0.2","10.0.0.1","TCP","66","34567  >  34382 [ACK] Seq=1 Ack=217201 Win=147456 Len=0 TSval=937268923 TSecr=3528861057"
"191","7.960103789","10.0.0.2","10.0.0.1","TCP","66","34567  >  34382 [ACK] Seq=1 Ack=220097 Win=153600 Len=0 TSval=937268965 TSecr=3528861104"
"192","7.983020937","10.0.0.2","10.0.0.1","TCP","66","34567  >  34382 [ACK] Seq=1 Ack=222993 Win=159232 Len=0 TSval=937268990 TSecr=3528861129"
"193","7.989377376","10.0.0.1","10.0.0.2","TCP","2962","34382  >  34567 [PSH, ACK] Seq=230233 Ack=1 Win=42496 Len=2896 TSval=3528861286 TSecr=937268923"
"194","8.010268514","10.0.0.2","10.0.0.1","TCP","66","34567  >  34382 [ACK] Seq=1 Ack=225889 Win=164864 Len=0 TSval=937269016 TSecr=3528861153"
"195","8.031838210","10.0.0.2","10.0.0.1","TCP","66","34567  >  34382 [ACK] Seq=1 Ack=228785 Win=171008 Len=0 TSval=937269039 TSecr=3528861177"
"196","8.034503466","10.0.0.1","10.0.0.2","TCP","2962","34382  >  34567 [PSH, ACK] Seq=233129 Ack=1 Win=42496 Len=2896 TSval=3528861331 TSecr=937268965"
"197","8.046312295","10.0.0.2","10.0.0.1","TCP","66","34567  >  34382 [ACK] Seq=1 Ack=230233 Win=173568 Len=0 TSval=937269052 TSecr=3528861177"
"198","8.058747164","10.0.0.1","10.0.0.2","TCP","2962","34382  >  34567 [PSH, ACK] Seq=236025 Ack=1 Win=42496 Len=2896 TSval=3528861354 TSecr=937268990"
"199","8.084698883","10.0.0.1","10.0.0.2","TCP","2962","34382  >  34567 [PSH, ACK] Seq=238921 Ack=1 Win=42496 Len=2896 TSval=3528861381 TSecr=937269016"
"200","8.109051319","10.0.0.1","10.0.0.2","TCP","2962","34382  >  34567 [PSH, ACK] Seq=241817 Ack=1 Win=42496 Len=2896 TSval=3528861403 TSecr=937269039"
"201","8.133709934","10.0.0.1","10.0.0.2","TCP","2962","34382  >  34567 [PSH, ACK] Seq=244713 Ack=1 Win=42496 Len=2896 TSval=3528861417 TSecr=937269052"
"202","8.139763908","10.0.0.2","10.0.0.1","TCP","66","34567  >  34382 [ACK] Seq=1 Ack=233129 Win=179712 Len=0 TSval=937269147 TSecr=3528861286"
"203","8.185017606","10.0.0.2","10.0.0.1","TCP","66","34567  >  34382 [ACK] Seq=1 Ack=236025 Win=185344 Len=0 TSval=937269193 TSecr=3528861331"
"204","8.209784547","10.0.0.2","10.0.0.1","TCP","66","34567  >  34382 [ACK] Seq=1 Ack=238921 Win=190976 Len=0 TSval=937269217 TSecr=3528861354"
"205","8.214594008","10.0.0.1","10.0.0.2","TCP","2962","34382  >  34567 [PSH, ACK] Seq=247609 Ack=1 Win=42496 Len=2896 TSval=3528861511 TSecr=937269147"
"206","8.235206795","10.0.0.2","10.0.0.1","TCP","66","34567  >  34382 [ACK] Seq=1 Ack=241817 Win=196608 Len=0 TSval=937269243 TSecr=3528861381"
"207","8.259422423","10.0.0.1","10.0.0.2","TCP","2962","34382  >  34567 [PSH, ACK] Seq=250505 Ack=1 Win=42496 Len=2896 TSval=3528861556 TSecr=937269193"
"208","8.259943437","10.0.0.2","10.0.0.1","TCP","66","34567  >  34382 [ACK] Seq=1 Ack=244713 Win=202752 Len=0 TSval=937269267 TSecr=3528861403"
"209","8.284946659","10.0.0.1","10.0.0.2","TCP","2962","34382  >  34567 [PSH, ACK] Seq=253401 Ack=1 Win=42496 Len=2896 TSval=3528861581 TSecr=937269217"
"210","8.285330978","10.0.0.2","10.0.0.1","TCP","66","34567  >  34382 [ACK] Seq=1 Ack=247609 Win=206848 Len=0 TSval=937269293 TSecr=3528861417"
"211","8.310808329","10.0.0.1","10.0.0.2","TCP","2962","34382  >  34567 [PSH, ACK] Seq=256297 Ack=1 Win=42496 Len=2896 TSval=3528861606 TSecr=937269243"
"212","8.334409802","10.0.0.1","10.0.0.2","TCP","2962","34382  >  34567 [PSH, ACK] Seq=259193 Ack=1 Win=42496 Len=2896 TSval=3528861631 TSecr=937269267"
"213","8.359710902","10.0.0.1","10.0.0.2","TCP","2962","34382  >  34567 [PSH, ACK] Seq=262089 Ack=1 Win=42496 Len=2896 TSval=3528861656 TSecr=937269293"
"214","8.364943245","10.0.0.2","10.0.0.1","TCP","66","34567  >  34382 [ACK] Seq=1 Ack=250505 Win=206848 Len=0 TSval=937269373 TSecr=3528861511"
"215","8.411926181","10.0.0.2","10.0.0.1","TCP","66","34567  >  34382 [ACK] Seq=1 Ack=253401 Win=206848 Len=0 TSval=937269419 TSecr=3528861556"
"216","8.435281770","10.0.0.2","10.0.0.1","TCP","66","34567  >  34382 [ACK] Seq=1 Ack=256297 Win=206848 Len=0 TSval=937269443 TSecr=3528861581"
"217","8.439336179","10.0.0.1","10.0.0.2","TCP","2962","34382  >  34567 [PSH, ACK] Seq=264985 Ack=1 Win=42496 Len=2896 TSval=3528861736 TSecr=937269373"
"218","8.462091431","10.0.0.2","10.0.0.1","TCP","66","34567  >  34382 [ACK] Seq=1 Ack=259193 Win=206848 Len=0 TSval=937269470 TSecr=3528861606"
"219","8.484999868","10.0.0.2","10.0.0.1","TCP","66","34567  >  34382 [ACK] Seq=1 Ack=262089 Win=206848 Len=0 TSval=937269493 TSecr=3528861631"
"220","8.486573276","10.0.0.1","10.0.0.2","TCP","2962","34382  >  34567 [PSH, ACK] Seq=267881 Ack=1 Win=42496 Len=2896 TSval=3528861783 TSecr=937269419"
"221","8.510478936","10.0.0.1","10.0.0.2","TCP","2962","34382  >  34567 [PSH, ACK] Seq=270777 Ack=1 Win=42496 Len=2896 TSval=3528861806 TSecr=937269443"
"222","8.511530082","10.0.0.2","10.0.0.1","TCP","66","34567  >  34382 [ACK] Seq=1 Ack=264985 Win=206848 Len=0 TSval=937269519 TSecr=3528861656"
"223","8.536406454","10.0.0.1","10.0.0.2","TCP","2962","34382  >  34567 [PSH, ACK] Seq=273673 Ack=1 Win=42496 Len=2896 TSval=3528861833 TSecr=937269470"
"224","8.561050711","10.0.0.1","10.0.0.2","TCP","2962","34382  >  34567 [PSH, ACK] Seq=276569 Ack=1 Win=42496 Len=2896 TSval=3528861856 TSecr=937269493"
"225","8.585945658","10.0.0.1","10.0.0.2","TCP","2962","34382  >  34567 [PSH, ACK] Seq=279465 Ack=1 Win=42496 Len=2896 TSval=3528861882 TSecr=937269519"
"226","8.589705420","10.0.0.2","10.0.0.1","TCP","66","34567  >  34382 [ACK] Seq=1 Ack=267881 Win=206848 Len=0 TSval=937269597 TSecr=3528861736"
"227","8.637534135","10.0.0.2","10.0.0.1","TCP","66","34567  >  34382 [ACK] Seq=1 Ack=270777 Win=206848 Len=0 TSval=937269645 TSecr=3528861783"
"228","8.662083245","10.0.0.2","10.0.0.1","TCP","66","34567  >  34382 [ACK] Seq=1 Ack=273673 Win=206848 Len=0 TSval=937269669 TSecr=3528861806"
"229","8.687200808","10.0.0.2","10.0.0.1","TCP","66","34567  >  34382 [ACK] Seq=1 Ack=276569 Win=206848 Len=0 TSval=937269695 TSecr=3528861833"
"230","8.712196842","10.0.0.2","10.0.0.1","TCP","66","34567  >  34382 [ACK] Seq=1 Ack=279465 Win=206848 Len=0 TSval=937269719 TSecr=3528861856"
"231","8.736761115","10.0.0.1","10.0.0.2","TCP","2962","[TCP Previous segment not captured] 34382  >  34567 [PSH, ACK] Seq=288153 Ack=1 Win=42496 Len=2896 TSval=3528862033 TSecr=937269669"
"232","8.737343304","10.0.0.2","10.0.0.1","TCP","66","34567  >  34382 [ACK] Seq=1 Ack=282361 Win=206848 Len=0 TSval=937269744 TSecr=3528861882"
"233","8.762381737","10.0.0.1","10.0.0.2","TCP","2962","34382  >  34567 [PSH, ACK] Seq=291049 Ack=1 Win=42496 Len=2896 TSval=3528862058 TSecr=937269695"
"234","8.811942979","10.0.0.1","10.0.0.2","TCP","2962","[TCP Previous segment not captured] 34382  >  34567 [PSH, ACK] Seq=296841 Ack=1 Win=42496 Len=2896 TSval=3528862108 TSecr=937269744"
"235","8.888667263","10.0.0.2","10.0.0.1","TCP","78","[TCP Dup ACK 232#1] 34567  >  34382 [ACK] Seq=1 Ack=282361 Win=206848 Len=0 TSval=937269895 TSecr=3528861882 SLE=288153 SRE=291049"
"236","8.913013435","10.0.0.2","10.0.0.1","TCP","78","[TCP Dup ACK 232#2] 34567  >  34382 [ACK] Seq=1 Ack=282361 Win=206848 Len=0 TSval=937269921 TSecr=3528861882 SLE=288153 SRE=293945"
"237","8.951368832","10.0.0.1","10.0.0.2","TCP","1514","[TCP Out-Of-Order] 34382  >  34567 [ACK] Seq=282361 Ack=1 Win=42496 Len=1448 TSval=3528862260 TSecr=937269895"
"238","8.963490571","10.0.0.2","10.0.0.1","TCP","86","[TCP Dup ACK 232#3] 34567  >  34382 [ACK] Seq=1 Ack=282361 Win=206848 Len=0 TSval=937269970 TSecr=3528861882 SLE=296841 SRE=299737 SLE=288153 SRE=293945"
"239","8.975320218","10.0.0.1","10.0.0.2","TCP","1514","[TCP Out-Of-Order] 34382  >  34567 [ACK] Seq=283809 Ack=1 Win=42496 Len=1448 TSval=3528862284 TSecr=937269921"
"240","8.988028530","10.0.0.1","10.0.0.2","TCP","1514","[TCP Out-Of-Order] 34382  >  34567 [ACK] Seq=285257 Ack=1 Win=42496 Len=1448 TSval=3528862284 TSecr=937269921"
"241","9.032550003","10.0.0.1","10.0.0.2","TCP","1514","[TCP Retransmission] 34382  >  34567 [ACK] Seq=286705 Ack=1 Win=42496 Len=1448 TSval=3528862334 TSecr=937269970"
"242","9.037782300","10.0.0.1","10.0.0.2","TCP","1514","[TCP Retransmission] 34382  >  34567 [ACK] Seq=293945 Ack=1 Win=42496 Len=1448 TSval=3528862334 TSecr=937269970"
"243","9.102144465","10.0.0.2","10.0.0.1","TCP","86","34567  >  34382 [ACK] Seq=1 Ack=283809 Win=205824 Len=0 TSval=937270110 TSecr=3528862260 SLE=296841 SRE=299737 SLE=288153 SRE=293945"
"244","9.133054794","10.0.0.2","10.0.0.1","TCP","86","34567  >  34382 [ACK] Seq=1 Ack=285257 Win=204800 Len=0 TSval=937270141 TSecr=3528862284 SLE=296841 SRE=299737 SLE=288153 SRE=293945"
"245","9.138685506","10.0.0.2","10.0.0.1","TCP","86","34567  >  34382 [ACK] Seq=1 Ack=286705 Win=203776 Len=0 TSval=937270146 TSecr=3528862284 SLE=296841 SRE=299737 SLE=288153 SRE=293945"
"246","9.164321729","10.0.0.1","10.0.0.2","TCP","1514","[TCP Retransmission] 34382  >  34567 [ACK] Seq=295393 Ack=1 Win=42496 Len=1448 TSval=3528862473 TSecr=937270110"
"247","9.183823889","10.0.0.2","10.0.0.1","TCP","78","34567  >  34382 [ACK] Seq=1 Ack=293945 Win=202240 Len=0 TSval=937270191 TSecr=3528862334 SLE=296841 SRE=299737"
"248","9.189276963","10.0.0.1","10.0.0.2","TCP","2962","34382  >  34567 [PSH, ACK] Seq=299737 Ack=1 Win=42496 Len=2896 TSval=3528862473 TSecr=937270110"
"249","9.189282163","10.0.0.2","10.0.0.1","TCP","78","34567  >  34382 [ACK] Seq=1 Ack=295393 Win=205824 Len=0 TSval=937270196 TSecr=3528862334 SLE=296841 SRE=299737"
"250","9.213716483","10.0.0.1","10.0.0.2","TCP","2962","[TCP Previous segment not captured] 34382  >  34567 [PSH, ACK] Seq=305529 Ack=1 Win=42496 Len=2896 TSval=3528862510 TSecr=937270146"
"251","9.246625949","10.0.0.1","10.0.0.2","TCP","1514","34382  >  34567 [ACK] Seq=308425 Ack=1 Win=42496 Len=1448 TSval=3528862555 TSecr=937270191"
"252","9.258218073","10.0.0.1","10.0.0.2","TCP","1514","34382  >  34567 [ACK] Seq=309873 Ack=1 Win=42496 Len=1448 TSval=3528862560 TSecr=937270196"
"253","9.314911038","10.0.0.2","10.0.0.1","TCP","66","34567  >  34382 [ACK] Seq=1 Ack=299737 Win=205824 Len=0 TSval=937270322 TSecr=3528862473"
"254","9.340388293","10.0.0.2","10.0.0.1","TCP","66","34567  >  34382 [ACK] Seq=1 Ack=302633 Win=206848 Len=0 TSval=937270348 TSecr=3528862473"
"255","9.365390951","10.0.0.2","10.0.0.1","TCP","78","[TCP Dup ACK 254#1] 34567  >  34382 [ACK] Seq=1 Ack=302633 Win=206848 Len=0 TSval=937270372 TSecr=3528862473 SLE=305529 SRE=308425"
"256","9.397880884","10.0.0.2","10.0.0.1","TCP","78","[TCP Dup ACK 254#2] 34567  >  34382 [ACK] Seq=1 Ack=302633 Win=206848 Len=0 TSval=937270405 TSecr=3528862473 SLE=305529 SRE=309873"
"257","9.409099919","10.0.0.2","10.0.0.1","TCP","78","[TCP Dup ACK 254#3] 34567  >  34382 [ACK] Seq=1 Ack=302633 Win=206848 Len=0 TSval=937270416 TSecr=3528862473 SLE=305529 SRE=311321"
"258","9.414906651","10.0.0.1","10.0.0.2","TCP","2962","[TCP Previous segment not captured] 34382  >  34567 [PSH, ACK] Seq=312769 Ack=1 Win=42496 Len=2896 TSval=3528862711 TSecr=937270348"
"259","9.440376964","10.0.0.1","10.0.0.2","TCP","2962","34382  >  34567 [PSH, ACK] Seq=315665 Ack=1 Win=42496 Len=2896 TSval=3528862736 TSecr=937270372"
"260","9.461012591","10.0.0.1","10.0.0.2","TCP","1514","[TCP Out-Of-Order] 34382  >  34567 [ACK] Seq=302633 Ack=1 Win=42496 Len=1448 TSval=3528862769 TSecr=937270405"
"261","9.567939630","10.0.0.2","10.0.0.1","TCP","86","[TCP Dup ACK 254#4] 34567  >  34382 [ACK] Seq=1 Ack=302633 Win=206848 Len=0 TSval=937270573 TSecr=3528862473 SLE=312769 SRE=315665 SLE=305529 SRE=311321"
"262","9.593700746","10.0.0.2","10.0.0.1","TCP","86","[TCP Dup ACK 254#5] 34567  >  34382 [ACK] Seq=1 Ack=302633 Win=206848 Len=0 TSval=937270599 TSecr=3528862473 SLE=312769 SRE=318561 SLE=305529 SRE=311321"
"263","9.611818305","10.0.0.2","10.0.0.1","TCP","86","34567  >  34382 [ACK] Seq=1 Ack=304081 Win=205824 Len=0 TSval=937270619 TSecr=3528862769 SLE=312769 SRE=318561 SLE=305529 SRE=311321"
"264","9.630173588","10.0.0.1","10.0.0.2","TCP","1514","[TCP Out-Of-Order] 34382  >  34567 [ACK] Seq=311321 Ack=1 Win=42496 Len=1448 TSval=3528862939 TSecr=937270573"
"265","9.668034288","10.0.0.1","10.0.0.2","TCP","2962","34382  >  34567 [PSH, ACK] Seq=318561 Ack=1 Win=42496 Len=2896 TSval=3528862965 TSecr=937270599"
"266","9.781162925","10.0.0.2","10.0.0.1","TCP","78","[TCP Dup ACK 263#1] 34567  >  34382 [ACK] Seq=1 Ack=304081 Win=205824 Len=0 TSval=937270788 TSecr=3528862769 SLE=305529 SRE=318561"
"267","9.819817929","10.0.0.2","10.0.0.1","TCP","78","[TCP Dup ACK 263#2] 34567  >  34382 [ACK] Seq=1 Ack=304081 Win=205824 Len=0 TSval=937270827 TSecr=3528862769 SLE=305529 SRE=321457"
"268","9.844295537","10.0.0.1","10.0.0.2","TCP","1514","[TCP Out-Of-Order] 34382  >  34567 [ACK] Seq=304081 Ack=1 Win=42496 Len=1448 TSval=3528863152 TSecr=937270788"
"269","9.995407602","10.0.0.2","10.0.0.1","TCP","66","34567  >  34382 [ACK] Seq=1 Ack=321457 Win=199168 Len=0 TSval=937271003 TSecr=3528863152"
"270","10.069735604","10.0.0.1","10.0.0.2","TCP","2962","34382  >  34567 [PSH, ACK] Seq=321457 Ack=1 Win=42496 Len=2896 TSval=3528863366 TSecr=937271003"
"271","10.220752447","10.0.0.2","10.0.0.1","TCP","66","34567  >  34382 [ACK] Seq=1 Ack=324353 Win=206848 Len=0 TSval=937271228 TSecr=3528863366"
"272","10.283586002","10.0.0.1","10.0.0.2","TCP","1514","[TCP Previous segment not captured] 34382  >  34567 [ACK] Seq=327249 Ack=1 Win=42496 Len=1448 TSval=3528863592 TSecr=937271228"
"273","10.435190077","10.0.0.2","10.0.0.1","TCP","78","[TCP Window Update] 34567  >  34382 [ACK] Seq=1 Ack=324353 Win=207872 Len=0 TSval=937271442 TSecr=3528863366 SLE=327249 SRE=328697"
"274","10.497441751","10.0.0.1","10.0.0.2","TCP","1514","[TCP Retransmission] 34382  >  34567 [ACK] Seq=324353 Ack=1 Win=42496 Len=1448 TSval=3528863806 TSecr=937271442"
"275","10.648811046","10.0.0.2","10.0.0.1","TCP","78","34567  >  34382 [ACK] Seq=1 Ack=325801 Win=206848 Len=0 TSval=937271656 TSecr=3528863806 SLE=327249 SRE=328697"
"276","10.711930031","10.0.0.1","10.0.0.2","TCP","1514","[TCP Retransmission] 34382  >  34567 [ACK] Seq=325801 Ack=1 Win=42496 Len=1448 TSval=3528864020 TSecr=937271656"
"277","10.723225569","10.0.0.1","10.0.0.2","TCP","1514","34382  >  34567 [ACK] Seq=328697 Ack=1 Win=42496 Len=1448 TSval=3528864020 TSecr=937271656"
"278","10.863636900","10.0.0.2","10.0.0.1","TCP","66","34567  >  34382 [ACK] Seq=1 Ack=328697 Win=206336 Len=0 TSval=937271871 TSecr=3528864020"
"279","10.920188913","10.0.0.2","10.0.0.1","TCP","66","34567  >  34382 [ACK] Seq=1 Ack=330145 Win=208896 Len=0 TSval=937271927 TSecr=3528864020"
"280","10.994691457","10.0.0.1","10.0.0.2","TCP","2962","[TCP Previous segment not captured] 34382  >  34567 [PSH, ACK] Seq=333041 Ack=1 Win=42496 Len=2896 TSval=3528864291 TSecr=937271927"
"281","11.145602016","10.0.0.2","10.0.0.1","TCP","78","[TCP Dup ACK 279#1] 34567  >  34382 [ACK] Seq=1 Ack=330145 Win=208896 Len=0 TSval=937272153 TSecr=3528864020 SLE=333041 SRE=335937"
"282","11.220636137","10.0.0.1","10.0.0.2","TCP","2962","[TCP Retransmission] 34382  >  34567 [PSH, ACK] Seq=330145 Ack=1 Win=42496 Len=2896 TSval=3528864517 TSecr=937272153"
"283","11.372048744","10.0.0.2","10.0.0.1","TCP","66","34567  >  34382 [ACK] Seq=1 Ack=335937 Win=204800 Len=0 TSval=937272379 TSecr=3528864517"
"284","11.434267343","10.0.0.1","10.0.0.2","TCP","1514","34382  >  34567 [ACK] Seq=335937 Ack=1 Win=42496 Len=1448 TSval=3528864743 TSecr=937272379"
"285","11.447175340","10.0.0.1","10.0.0.2","TCP","1514","34382  >  34567 [ACK] Seq=337385 Ack=1 Win=42496 Len=1448 TSval=3528864743 TSecr=937272379"
"286","11.459328381","10.0.0.1","10.0.0.2","TCP","1514","34382  >  34567 [ACK] Seq=338833 Ack=1 Win=42496 Len=1448 TSval=3528864743 TSecr=937272379"
"287","11.599411445","10.0.0.2","10.0.0.1","TCP","66","34567  >  34382 [ACK] Seq=1 Ack=338833 Win=207872 Len=0 TSval=937272607 TSecr=3528864743"
"288","11.662560393","10.0.0.1","10.0.0.2","TCP","1514","34382  >  34567 [ACK] Seq=340281 Ack=1 Win=42496 Len=1448 TSval=3528864970 TSecr=937272607"
"289","11.665620768","10.0.0.2","10.0.0.1","TCP","66","34567  >  34382 [ACK] Seq=1 Ack=340281 Win=208896 Len=0 TSval=937272671 TSecr=3528864743"
"290","11.673756695","10.0.0.1","10.0.0.2","TCP","1514","34382  >  34567 [ACK] Seq=341729 Ack=1 Win=42496 Len=1448 TSval=3528864970 TSecr=937272607"
"291","11.728076520","10.0.0.1","10.0.0.2","TCP","1514","34382  >  34567 [ACK] Seq=343177 Ack=1 Win=42496 Len=1448 TSval=3528865037 TSecr=937272671"
"292","11.824761640","10.0.0.2","10.0.0.1","TCP","66","34567  >  34382 [ACK] Seq=1 Ack=343177 Win=208896 Len=0 TSval=937272832 TSecr=3528864970"
"293","11.886940750","10.0.0.1","10.0.0.2","TCP","1514","34382  >  34567 [ACK] Seq=344625 Ack=1 Win=42496 Len=1448 TSval=3528865196 TSecr=937272832"
"294","11.899061638","10.0.0.1","10.0.0.2","TCP","1514","34382  >  34567 [ACK] Seq=346073 Ack=1 Win=42496 Len=1448 TSval=3528865196 TSecr=937272832"
"295","11.968243022","10.0.0.2","10.0.0.1","TCP","66","34567  >  34382 [ACK] Seq=1 Ack=344625 Win=208896 Len=0 TSval=937272975 TSecr=3528865037"
"296","12.030469687","10.0.0.1","10.0.0.2","TCP","1514","34382  >  34567 [ACK] Seq=347521 Ack=1 Win=42496 Len=1448 TSval=3528865339 TSecr=937272975"
"297","12.055356617","10.0.0.2","10.0.0.1","TCP","66","34567  >  34382 [ACK] Seq=1 Ack=347521 Win=208896 Len=0 TSval=937273057 TSecr=3528865196"
"298","12.117730157","10.0.0.1","10.0.0.2","TCP","1514","34382  >  34567 [ACK] Seq=348969 Ack=1 Win=42496 Len=1448 TSval=3528865426 TSecr=937273057"
"299","12.129715275","10.0.0.1","10.0.0.2","TCP","1514","34382  >  34567 [ACK] Seq=350417 Ack=1 Win=42496 Len=1448 TSval=3528865426 TSecr=937273057"
"300","12.268154444","10.0.0.2","10.0.0.1","TCP","66","34567  >  34382 [ACK] Seq=1 Ack=350417 Win=208896 Len=0 TSval=937273276 TSecr=3528865339"
"301","12.343849312","10.0.0.1","10.0.0.2","TCP","2962","34382  >  34567 [PSH, ACK] Seq=351865 Ack=1 Win=42496 Len=2896 TSval=3528865639 TSecr=937273276"
"302","12.395852032","10.0.0.2","10.0.0.1","TCP","66","34567  >  34382 [ACK] Seq=1 Ack=351865 Win=208896 Len=0 TSval=937273403 TSecr=3528865426"
"303","12.470362963","10.0.0.1","10.0.0.2","TCP","2962","34382  >  34567 [PSH, ACK] Seq=354761 Ack=1 Win=42496 Len=2896 TSval=3528865767 TSecr=937273403"
"304","12.496887262","10.0.0.2","10.0.0.1","TCP","66","34567  >  34382 [ACK] Seq=1 Ack=354761 Win=208896 Len=0 TSval=937273503 TSecr=3528865639"
"305","12.571197766","10.0.0.1","10.0.0.2","TCP","2962","34382  >  34567 [PSH, ACK] Seq=357657 Ack=1 Win=42496 Len=2896 TSval=3528865868 TSecr=937273503"
"306","12.620825132","10.0.0.2","10.0.0.1","TCP","66","34567  >  34382 [ACK] Seq=1 Ack=357657 Win=208896 Len=0 TSval=937273629 TSecr=3528865767"
"307","12.722930208","10.0.0.2","10.0.0.1","TCP","66","34567  >  34382 [ACK] Seq=1 Ack=360553 Win=208896 Len=0 TSval=937273729 TSecr=3528865868"
"308","12.797247508","10.0.0.1","10.0.0.2","TCP","2962","[TCP Previous segment not captured] 34382  >  34567 [PSH, ACK] Seq=363449 Ack=1 Win=42496 Len=2896 TSval=3528866094 TSecr=937273729"
"309","12.809521216","10.0.0.1","10.0.0.2","TCP","1514","34382  >  34567 [ACK] Seq=366345 Ack=1 Win=42496 Len=1448 TSval=3528866094 TSecr=937273729"
"310","12.947989506","10.0.0.2","10.0.0.1","TCP","78","[TCP Dup ACK 307#1] 34567  >  34382 [ACK] Seq=1 Ack=360553 Win=208896 Len=0 TSval=937273956 TSecr=3528865868 SLE=363449 SRE=366345"
"311","12.960853512","10.0.0.2","10.0.0.1","TCP","78","[TCP Dup ACK 307#2] 34567  >  34382 [ACK] Seq=1 Ack=360553 Win=208896 Len=0 TSval=937273968 TSecr=3528865868 SLE=363449 SRE=367793"
"312","13.022392521","10.0.0.1","10.0.0.2","TCP","2962","[TCP Retransmission] 34382  >  34567 [PSH, ACK] Seq=360553 Ack=1 Win=42496 Len=2896 TSval=3528866319 TSecr=937273956"
"313","13.034450525","10.0.0.1","10.0.0.2","TCP","1514","34382  >  34567 [ACK] Seq=367793 Ack=1 Win=42496 Len=1448 TSval=3528866332 TSecr=937273968"
"314","13.172857293","10.0.0.2","10.0.0.1","TCP","66","34567  >  34382 [ACK] Seq=1 Ack=367793 Win=204288 Len=0 TSval=937274181 TSecr=3528866319"
"315","13.235134111","10.0.0.1","10.0.0.2","TCP","1514","34382  >  34567 [ACK] Seq=369241 Ack=1 Win=42496 Len=1448 TSval=3528866544 TSecr=937274181"
"316","13.247204769","10.0.0.1","10.0.0.2","TCP","1514","34382  >  34567 [ACK] Seq=370689 Ack=1 Win=42496 Len=1448 TSval=3528866544 TSecr=937274181"
"317","13.327434729","10.0.0.2","10.0.0.1","TCP","66","34567  >  34382 [ACK] Seq=1 Ack=369241 Win=208896 Len=0 TSval=937274335 TSecr=3528866332"
"318","13.397842345","10.0.0.2","10.0.0.1","TCP","66","34567  >  34382 [ACK] Seq=1 Ack=372137 Win=208896 Len=0 TSval=937274405 TSecr=3528866544"
"319","13.401896007","10.0.0.1","10.0.0.2","TCP","2962","34382  >  34567 [PSH, ACK] Seq=372137 Ack=1 Win=42496 Len=2896 TSval=3528866698 TSecr=937274335"
"320","13.460633630","10.0.0.1","10.0.0.2","TCP","1514","34382  >  34567 [ACK] Seq=375033 Ack=1 Win=42496 Len=1448 TSval=3528866769 TSecr=937274405"
"321","13.472806504","10.0.0.1","10.0.0.2","TCP","1514","34382  >  34567 [ACK] Seq=376481 Ack=1 Win=42496 Len=1448 TSval=3528866769 TSecr=937274405"
"322","13.552413849","10.0.0.2","10.0.0.1","TCP","66","34567  >  34382 [ACK] Seq=1 Ack=375033 Win=208896 Len=0 TSval=937274560 TSecr=3528866698"
"323","13.623310460","10.0.0.2","10.0.0.1","TCP","66","34567  >  34382 [ACK] Seq=1 Ack=377929 Win=208896 Len=0 TSval=937274631 TSecr=3528866769"
"324","13.626905905","10.0.0.1","10.0.0.2","TCP","2962","34382  >  34567 [PSH, ACK] Seq=377929 Ack=1 Win=42496 Len=2896 TSval=3528866923 TSecr=937274560"
"325","13.697857599","10.0.0.1","10.0.0.2","TCP","2962","34382  >  34567 [PSH, ACK] Seq=380825 Ack=1 Win=42496 Len=2896 TSval=3528866994 TSecr=937274631"
"326","13.709963664","10.0.0.1","10.0.0.2","TCP","1514","34382  >  34567 [ACK] Seq=383721 Ack=1 Win=42496 Len=1448 TSval=3528866994 TSecr=937274631"
"327","13.779443355","10.0.0.2","10.0.0.1","TCP","66","34567  >  34382 [ACK] Seq=1 Ack=380825 Win=208896 Len=0 TSval=937274787 TSecr=3528866923"
"328","13.849815300","10.0.0.2","10.0.0.1","TCP","66","34567  >  34382 [ACK] Seq=1 Ack=383721 Win=208896 Len=0 TSval=937274856 TSecr=3528866994"
"329","13.853879251","10.0.0.1","10.0.0.2","TCP","2962","34382  >  34567 [PSH, ACK] Seq=385169 Ack=1 Win=42496 Len=2896 TSval=3528867150 TSecr=937274787"
"330","13.924856277","10.0.0.1","10.0.0.2","TCP","2962","34382  >  34567 [PSH, ACK] Seq=388065 Ack=1 Win=42496 Len=2896 TSval=3528867221 TSecr=937274856"
"331","13.944469396","10.0.0.2","10.0.0.1","TCP","66","34567  >  34382 [ACK] Seq=1 Ack=385169 Win=208896 Len=0 TSval=937274951 TSecr=3528866994"
"332","14.005334681","10.0.0.2","10.0.0.1","TCP","66","34567  >  34382 [ACK] Seq=1 Ack=388065 Win=208896 Len=0 TSval=937275012 TSecr=3528867150"
"333","14.007268528","10.0.0.1","10.0.0.2","TCP","1514","34382  >  34567 [ACK] Seq=390961 Ack=1 Win=42496 Len=1448 TSval=3528867315 TSecr=937274951"
"334","14.076560117","10.0.0.2","10.0.0.1","TCP","66","34567  >  34382 [ACK] Seq=1 Ack=390961 Win=208896 Len=0 TSval=937275084 TSecr=3528867221"
"335","14.150976401","10.0.0.1","10.0.0.2","TCP","2962","[TCP Previous segment not captured] 34382  >  34567 [PSH, ACK] Seq=395305 Ack=1 Win=42496 Len=2896 TSval=3528867448 TSecr=937275084"
"336","14.301318453","10.0.0.2","10.0.0.1","TCP","78","34567  >  34382 [ACK] Seq=1 Ack=392409 Win=207872 Len=0 TSval=937275309 TSecr=3528867315 SLE=395305 SRE=398201"
"337","14.376501630","10.0.0.1","10.0.0.2","TCP","2962","34382  >  34567 [PSH, ACK] Seq=398201 Ack=1 Win=42496 Len=2896 TSval=3528867672 TSecr=937275309"
"338","14.485561546","10.0.0.1","10.0.0.2","TCP","1514","[TCP Out-Of-Order] 34382  >  34567 [ACK] Seq=392409 Ack=1 Win=42496 Len=1448 TSval=3528867794 TSecr=937275309"
"339","14.528490795","10.0.0.2","10.0.0.1","TCP","78","[TCP Dup ACK 336#1] 34567  >  34382 [ACK] Seq=1 Ack=392409 Win=207872 Len=0 TSval=937275536 TSecr=3528867315 SLE=395305 SRE=401097"
"340","14.591051012","10.0.0.1","10.0.0.2","TCP","1514","[TCP Retransmission] 34382  >  34567 [ACK] Seq=393857 Ack=1 Win=42496 Len=1448 TSval=3528867900 TSecr=937275536"
"341","14.603031952","10.0.0.1","10.0.0.2","TCP","1514","34382  >  34567 [ACK] Seq=401097 Ack=1 Win=42496 Len=1448 TSval=3528867900 TSecr=937275536"
"342","14.636569794","10.0.0.2","10.0.0.1","TCP","78","34567  >  34382 [ACK] Seq=1 Ack=393857 Win=206848 Len=0 TSval=937275644 TSecr=3528867794 SLE=395305 SRE=401097"
"343","14.698868583","10.0.0.1","10.0.0.2","TCP","1514","34382  >  34567 [ACK] Seq=402545 Ack=1 Win=42496 Len=1448 TSval=3528868008 TSecr=937275644"
"344","14.741578821","10.0.0.2","10.0.0.1","TCP","66","34567  >  34382 [ACK] Seq=1 Ack=401097 Win=204288 Len=0 TSval=937275749 TSecr=3528867900"
"345","14.849718664","10.0.0.2","10.0.0.1","TCP","66","34567  >  34382 [ACK] Seq=1 Ack=403993 Win=207872 Len=0 TSval=937275857 TSecr=3528867900"
"346","14.924384736","10.0.0.1","10.0.0.2","TCP","2962","[TCP Previous segment not captured] 34382  >  34567 [PSH, ACK] Seq=405441 Ack=1 Win=42496 Len=2896 TSval=3528868221 TSecr=937275857"
"347","14.936168597","10.0.0.1","10.0.0.2","TCP","1514","34382  >  34567 [ACK] Seq=408337 Ack=1 Win=42496 Len=1448 TSval=3528868221 TSecr=937275857"
"348","15.075230109","10.0.0.2","10.0.0.1","TCP","78","[TCP Dup ACK 345#1] 34567  >  34382 [ACK] Seq=1 Ack=403993 Win=207872 Len=0 TSval=937276083 TSecr=3528867900 SLE=405441 SRE=408337"
"349","15.086980608","10.0.0.2","10.0.0.1","TCP","78","[TCP Dup ACK 345#2] 34567  >  34382 [ACK] Seq=1 Ack=403993 Win=207872 Len=0 TSval=937276094 TSecr=3528867900 SLE=405441 SRE=409785"
"350","15.137568782","10.0.0.1","10.0.0.2","TCP","1514","[TCP Out-Of-Order] 34382  >  34567 [ACK] Seq=403993 Ack=1 Win=42496 Len=1448 TSval=3528868446 TSecr=937276083"
"351","15.288546341","10.0.0.2","10.0.0.1","TCP","66","34567  >  34382 [ACK] Seq=1 Ack=409785 Win=204800 Len=0 TSval=937276296 TSecr=3528868446"
"352","15.351328274","10.0.0.1","10.0.0.2","TCP","1514","[TCP Previous segment not captured] 34382  >  34567 [ACK] Seq=411233 Ack=1 Win=42496 Len=1448 TSval=3528868660 TSecr=937276296"
"353","15.502275407","10.0.0.2","10.0.0.1","TCP","78","[TCP Window Update] 34567  >  34382 [ACK] Seq=1 Ack=409785 Win=207872 Len=0 TSval=937276510 TSecr=3528868446 SLE=411233 SRE=412681"
"354","15.564531164","10.0.0.1","10.0.0.2","TCP","1514","[TCP Retransmission] 34382  >  34567 [ACK] Seq=409785 Ack=1 Win=42496 Len=1448 TSval=3528868873 TSecr=937276510"
"355","15.715895105","10.0.0.2","10.0.0.1","TCP","66","34567  >  34382 [ACK] Seq=1 Ack=412681 Win=206336 Len=0 TSval=937276723 TSecr=3528868873"
"356","15.785298112","10.0.0.1","10.0.0.2","TCP","1514","[TCP Previous segment not captured] 34382  >  34567 [ACK] Seq=414129 Ack=1 Win=42496 Len=1448 TSval=3528869087 TSecr=937276723"
"357","15.937065394","10.0.0.2","10.0.0.1","TCP","78","[TCP Window Update] 34567  >  34382 [ACK] Seq=1 Ack=412681 Win=207872 Len=0 TSval=937276943 TSecr=3528868873 SLE=414129 SRE=415577"
"358","15.999382333","10.0.0.1","10.0.0.2","TCP","1514","34382  >  34567 [ACK] Seq=415577 Ack=1 Win=42496 Len=1448 TSval=3528869308 TSecr=937276943"
"359","16.061724716","10.0.0.1","10.0.0.2","TCP","1514","[TCP Out-Of-Order] 34382  >  34567 [ACK] Seq=412681 Ack=1 Win=42496 Len=1448 TSval=3528869370 TSecr=937276943"
"360","16.152100176","10.0.0.2","10.0.0.1","TCP","78","[TCP Dup ACK 355#1] 34567  >  34382 [ACK] Seq=1 Ack=412681 Win=207872 Len=0 TSval=937277159 TSecr=3528868873 SLE=414129 SRE=417025"
"361","16.213380213","10.0.0.2","10.0.0.1","TCP","66","34567  >  34382 [ACK] Seq=1 Ack=417025 Win=204800 Len=0 TSval=937277221 TSecr=3528869370"
"362","16.214304778","10.0.0.1","10.0.0.2","TCP","1514","34382  >  34567 [ACK] Seq=417025 Ack=1 Win=42496 Len=1448 TSval=3528869523 TSecr=937277159"
"363","16.275824940","10.0.0.1","10.0.0.2","TCP","1514","34382  >  34567 [ACK] Seq=418473 Ack=1 Win=42496 Len=1448 TSval=3528869584 TSecr=937277221"
"364","16.426679297","10.0.0.2","10.0.0.1","TCP","66","34567  >  34382 [ACK] Seq=1 Ack=419921 Win=207872 Len=0 TSval=937277434 TSecr=3528869523"
"365","16.488938541","10.0.0.1","10.0.0.2","TCP","1514","34382  >  34567 [ACK] Seq=419921 Ack=1 Win=42496 Len=1448 TSval=3528869798 TSecr=937277434"
"366","16.501105058","10.0.0.1","10.0.0.2","TCP","1514","34382  >  34567 [ACK] Seq=421369 Ack=1 Win=42496 Len=1448 TSval=3528869798 TSecr=937277434"
"367","16.653256472","10.0.0.2","10.0.0.1","TCP","66","34567  >  34382 [ACK] Seq=1 Ack=422817 Win=207872 Len=0 TSval=937277659 TSecr=3528869798"
"368","16.728795315","10.0.0.1","10.0.0.2","TCP","2962","34382  >  34567 [PSH, ACK] Seq=422817 Ack=1 Win=42496 Len=2896 TSval=3528870024 TSecr=937277659"
"369","16.751797820","10.0.0.1","10.0.0.2","TCP","2962","34382  >  34567 [PSH, ACK] Seq=425713 Ack=1 Win=42496 Len=2896 TSval=3528870024 TSecr=937277659"
"370","16.879443799","10.0.0.2","10.0.0.1","TCP","66","34567  >  34382 [ACK] Seq=1 Ack=425713 Win=208896 Len=0 TSval=937277887 TSecr=3528870024"
"371","16.908693999","10.0.0.2","10.0.0.1","TCP","66","34567  >  34382 [ACK] Seq=1 Ack=428609 Win=208896 Len=0 TSval=937277916 TSecr=3528870024"
"372","16.953810920","10.0.0.1","10.0.0.2","TCP","2962","34382  >  34567 [PSH, ACK] Seq=428609 Ack=1 Win=42496 Len=2896 TSval=3528870250 TSecr=937277887"
"373","16.983029041","10.0.0.1","10.0.0.2","TCP","2962","34382  >  34567 [PSH, ACK] Seq=431505 Ack=1 Win=42496 Len=2896 TSval=3528870280 TSecr=937277916"
"374","17.104500459","10.0.0.2","10.0.0.1","TCP","66","34567  >  34382 [ACK] Seq=1 Ack=431505 Win=208896 Len=0 TSval=937278112 TSecr=3528870250"
"375","17.133812336","10.0.0.2","10.0.0.1","TCP","66","34567  >  34382 [ACK] Seq=1 Ack=434401 Win=208896 Len=0 TSval=937278141 TSecr=3528870280"
"376","17.179153795","10.0.0.1","10.0.0.2","TCP","2962","34382  >  34567 [PSH, ACK] Seq=434401 Ack=1 Win=42496 Len=2896 TSval=3528870475 TSecr=937278112"
"377","17.208205055","10.0.0.1","10.0.0.2","TCP","2962","34382  >  34567 [PSH, ACK] Seq=437297 Ack=1 Win=42496 Len=2896 TSval=3528870505 TSecr=937278141"
"378","17.330593753","10.0.0.2","10.0.0.1","TCP","66","34567  >  34382 [ACK] Seq=1 Ack=437297 Win=208896 Len=0 TSval=937278338 TSecr=3528870475"
"379","17.361271189","10.0.0.2","10.0.0.1","TCP","66","34567  >  34382 [ACK] Seq=1 Ack=440193 Win=208896 Len=0 TSval=937278366 TSecr=3528870505"
"380","17.393018892","10.0.0.1","10.0.0.2","TCP","1514","34382  >  34567 [ACK] Seq=440193 Ack=1 Win=42496 Len=1448 TSval=3528870702 TSecr=937278338"
"381","17.423538397","10.0.0.1","10.0.0.2","TCP","1514","[TCP Previous segment not captured] 34382  >  34567 [ACK] Seq=444537 Ack=1 Win=42496 Len=1448 TSval=3528870732 TSecr=937278366"
"382","17.575409458","10.0.0.2","10.0.0.1","TCP","78","34567  >  34382 [ACK] Seq=1 Ack=441641 Win=207872 Len=0 TSval=937278582 TSecr=3528870702 SLE=444537 SRE=445985"
"383","17.649742474","10.0.0.1","10.0.0.2","TCP","2962","34382  >  34567 [PSH, ACK] Seq=445985 Ack=1 Win=42496 Len=2896 TSval=3528870946 TSecr=937278582"
"384","17.733423501","10.0.0.1","10.0.0.2","TCP","1514","[TCP Out-Of-Order] 34382  >  34567 [ACK] Seq=441641 Ack=1 Win=42496 Len=1448 TSval=3528871042 TSecr=937278582"
"385","17.801142893","10.0.0.2","10.0.0.1","TCP","78","[TCP Dup ACK 382#1] 34567  >  34382 [ACK] Seq=1 Ack=441641 Win=207872 Len=0 TSval=937278808 TSecr=3528870702 SLE=444537 SRE=448881"
"386","17.863958637","10.0.0.1","10.0.0.2","TCP","1514","[TCP Retransmission] 34382  >  34567 [ACK] Seq=443089 Ack=1 Win=42496 Len=1448 TSval=3528871172 TSecr=937278808"
"387","17.875512868","10.0.0.1","10.0.0.2","TCP","1514","34382  >  34567 [ACK] Seq=448881 Ack=1 Win=42496 Len=1448 TSval=3528871172 TSecr=937278808"
"388","17.884123805","10.0.0.2","10.0.0.1","TCP","78","34567  >  34382 [ACK] Seq=1 Ack=443089 Win=206848 Len=0 TSval=937278892 TSecr=3528871042 SLE=444537 SRE=448881"
"389","17.946435927","10.0.0.1","10.0.0.2","TCP","1514","34382  >  34567 [ACK] Seq=450329 Ack=1 Win=42496 Len=1448 TSval=3528871255 TSecr=937278892"
"390","18.015717607","10.0.0.2","10.0.0.1","TCP","66","34567  >  34382 [ACK] Seq=1 Ack=448881 Win=204800 Len=0 TSval=937279022 TSecr=3528871172"
"391","18.075857365","10.0.0.2","10.0.0.1","TCP","66","34567  >  34382 [ACK] Seq=1 Ack=450329 Win=208896 Len=0 TSval=937279083 TSecr=3528871172"
"392","18.077940512","10.0.0.1","10.0.0.2","TCP","1514","34382  >  34567 [ACK] Seq=451777 Ack=1 Win=42496 Len=1448 TSval=3528871387 TSecr=937279022"
"393","18.138223589","10.0.0.1","10.0.0.2","TCP","1514","34382  >  34567 [ACK] Seq=453225 Ack=1 Win=42496 Len=1448 TSval=3528871447 TSecr=937279083"
"394","18.219661763","10.0.0.2","10.0.0.1","TCP","66","34567  >  34382 [ACK] Seq=1 Ack=451777 Win=208896 Len=0 TSval=937279227 TSecr=3528871255"
"395","18.289498784","10.0.0.2","10.0.0.1","TCP","66","34567  >  34382 [ACK] Seq=1 Ack=454673 Win=208896 Len=0 TSval=937279297 TSecr=3528871387"
"396","18.294846566","10.0.0.1","10.0.0.2","TCP","2962","34382  >  34567 [PSH, ACK] Seq=454673 Ack=1 Win=42496 Len=2896 TSval=3528871591 TSecr=937279227"
"397","18.445754802","10.0.0.2","10.0.0.1","TCP","66","34567  >  34382 [ACK] Seq=1 Ack=457569 Win=208896 Len=0 TSval=937279453 TSecr=3528871591"
"398","18.813329977","10.0.0.1","10.0.0.2","TCP","1514","[TCP Previous segment not captured] 34382  >  34567 [ACK] Seq=463361 Ack=1 Win=42496 Len=1448 TSval=3528872122 TSecr=937279453"
"399","18.963876516","10.0.0.2","10.0.0.1","TCP","78","[TCP Dup ACK 397#1] 34567  >  34382 [ACK] Seq=1 Ack=457569 Win=208896 Len=0 TSval=937279971 TSecr=3528871591 SLE=463361 SRE=464809"
"400","19.026898456","10.0.0.1","10.0.0.2","TCP","1514","[TCP Retransmission] 34382  >  34567 [ACK] Seq=457569 Ack=1 Win=42496 Len=1448 TSval=3528872335 TSecr=937279971"
"401","19.177925656","10.0.0.2","10.0.0.1","TCP","78","34567  >  34382 [ACK] Seq=1 Ack=459017 Win=207872 Len=0 TSval=937280185 TSecr=3528872335 SLE=463361 SRE=464809"
"402","19.240983101","10.0.0.1","10.0.0.2","TCP","1514","[TCP Retransmission] 34382  >  34567 [ACK] Seq=459017 Ack=1 Win=42496 Len=1448 TSval=3528872549 TSecr=937280185"
"403","19.253571668","10.0.0.1","10.0.0.2","TCP","1514","[TCP Retransmission] 34382  >  34567 [ACK] Seq=460465 Ack=1 Win=42496 Len=1448 TSval=3528872549 TSecr=937280185"
"404","19.391554388","10.0.0.2","10.0.0.1","TCP","78","34567  >  34382 [ACK] Seq=1 Ack=460465 Win=206848 Len=0 TSval=937280399 TSecr=3528872549 SLE=463361 SRE=464809"
"405","19.406631399","10.0.0.2","10.0.0.1","TCP","78","34567  >  34382 [ACK] Seq=1 Ack=461913 Win=206336 Len=0 TSval=937280413 TSecr=3528872549 SLE=463361 SRE=464809"
"406","19.453885396","10.0.0.1","10.0.0.2","TCP","1514","[TCP Retransmission] 34382  >  34567 [ACK] Seq=461913 Ack=1 Win=42496 Len=1448 TSval=3528872763 TSecr=937280399"
"407","19.466030653","10.0.0.1","10.0.0.2","TCP","1514","34382  >  34567 [ACK] Seq=464809 Ack=1 Win=42496 Len=1448 TSval=3528872763 TSecr=937280399"
"408","19.478108733","10.0.0.1","10.0.0.2","TCP","1514","34382  >  34567 [ACK] Seq=466257 Ack=1 Win=42496 Len=1448 TSval=3528872778 TSecr=937280413"
"409","19.605217514","10.0.0.2","10.0.0.1","TCP","66","34567  >  34382 [ACK] Seq=1 Ack=464809 Win=206336 Len=0 TSval=937280613 TSecr=3528872763"
"410","19.628718693","10.0.0.2","10.0.0.1","TCP","66","34567  >  34382 [ACK] Seq=1 Ack=467705 Win=207872 Len=0 TSval=937280636 TSecr=3528872763"
"411","19.667701949","10.0.0.1","10.0.0.2","TCP","1514","34382  >  34567 [ACK] Seq=467705 Ack=1 Win=42496 Len=1448 TSval=3528872976 TSecr=937280613"
"412","19.703445826","10.0.0.1","10.0.0.2","TCP","2962","34382  >  34567 [PSH, ACK] Seq=469153 Ack=1 Win=42496 Len=2896 TSval=3528873000 TSecr=937280636"
"413","19.715349792","10.0.0.1","10.0.0.2","TCP","1514","34382  >  34567 [ACK] Seq=472049 Ack=1 Win=42496 Len=1448 TSval=3528873000 TSecr=937280636"
"414","19.854720226","10.0.0.2","10.0.0.1","TCP","66","34567  >  34382 [ACK] Seq=1 Ack=472049 Win=208896 Len=0 TSval=937280862 TSecr=3528872976"
"415","19.929225950","10.0.0.1","10.0.0.2","TCP","2962","34382  >  34567 [PSH, ACK] Seq=473497 Ack=1 Win=42496 Len=2896 TSval=3528873226 TSecr=937280862"
"416","19.929233274","10.0.0.2","10.0.0.1","TCP","66","34567  >  34382 [ACK] Seq=1 Ack=473497 Win=208896 Len=0 TSval=937280932 TSecr=3528873000"
"417","20.003687342","10.0.0.1","10.0.0.2","TCP","2962","34382  >  34567 [PSH, ACK] Seq=476393 Ack=1 Win=42496 Len=2896 TSval=3528873300 TSecr=937280932"
"418","20.015788747","10.0.0.1","10.0.0.2","TCP","1514","34382  >  34567 [ACK] Seq=479289 Ack=1 Win=42496 Len=1448 TSval=3528873300 TSecr=937280932"
"419","20.081326958","10.0.0.2","10.0.0.1","TCP","66","34567  >  34382 [ACK] Seq=1 Ack=476393 Win=208896 Len=0 TSval=937281088 TSecr=3528873226"
"420","20.155851157","10.0.0.2","10.0.0.1","TCP","66","34567  >  34382 [ACK] Seq=1 Ack=479289 Win=208896 Len=0 TSval=937281163 TSecr=3528873300"
"421","20.230425229","10.0.0.1","10.0.0.2","TCP","2962","[TCP Previous segment not captured] 34382  >  34567 [PSH, ACK] Seq=483633 Ack=1 Win=42496 Len=2896 TSval=3528873527 TSecr=937281163"
"422","20.252065210","10.0.0.2","10.0.0.1","TCP","66","34567  >  34382 [ACK] Seq=1 Ack=480737 Win=208896 Len=0 TSval=937281259 TSecr=3528873300"
"423","20.315372668","10.0.0.1","10.0.0.2","TCP","1514","34382  >  34567 [ACK] Seq=486529 Ack=1 Win=42496 Len=1448 TSval=3528873623 TSecr=937281259"
"424","20.382001247","10.0.0.2","10.0.0.1","TCP","78","[TCP Dup ACK 422#1] 34567  >  34382 [ACK] Seq=1 Ack=480737 Win=208896 Len=0 TSval=937281389 TSecr=3528873300 SLE=483633 SRE=486529"
"425","20.467427253","10.0.0.2","10.0.0.1","TCP","78","[TCP Dup ACK 422#2] 34567  >  34382 [ACK] Seq=1 Ack=480737 Win=208896 Len=0 TSval=937281475 TSecr=3528873300 SLE=483633 SRE=487977"
"426","20.530243967","10.0.0.1","10.0.0.2","TCP","1514","34382  >  34567 [ACK] Seq=487977 Ack=1 Win=42496 Len=1448 TSval=3528873839 TSecr=937281475"
"427","20.681883853","10.0.0.2","10.0.0.1","TCP","78","[TCP Dup ACK 422#3] 34567  >  34382 [ACK] Seq=1 Ack=480737 Win=208896 Len=0 TSval=937281689 TSecr=3528873300 SLE=483633 SRE=489425"
"428","20.744598617","10.0.0.1","10.0.0.2","TCP","1514","[TCP Retransmission] 34382  >  34567 [ACK] Seq=480737 Ack=1 Win=42496 Len=1448 TSval=3528874053 TSecr=937281689"
"429","20.895538221","10.0.0.2","10.0.0.1","TCP","78","34567  >  34382 [ACK] Seq=1 Ack=482185 Win=207872 Len=0 TSval=937281903 TSecr=3528874053 SLE=483633 SRE=489425"
"430","20.957967891","10.0.0.1","10.0.0.2","TCP","1514","34382  >  34567 [ACK] Seq=489425 Ack=1 Win=42496 Len=1448 TSval=3528874267 TSecr=937281903"
"431","21.108659652","10.0.0.2","10.0.0.1","TCP","78","[TCP Dup ACK 429#1] 34567  >  34382 [ACK] Seq=1 Ack=482185 Win=207872 Len=0 TSval=937282116 TSecr=3528874053 SLE=483633 SRE=490873"
"432","21.171029665","10.0.0.1","10.0.0.2","TCP","1514","[TCP Retransmission] 34382  >  34567 [ACK] Seq=482185 Ack=1 Win=42496 Len=1448 TSval=3528874480 TSecr=937282116"
"433","21.323571981","10.0.0.2","10.0.0.1","TCP","66","34567  >  34382 [ACK] Seq=1 Ack=490873 Win=203264 Len=0 TSval=937282330 TSecr=3528874480"
"434","21.386449120","10.0.0.1","10.0.0.2","TCP","1514","34382  >  34567 [ACK] Seq=490873 Ack=1 Win=42496 Len=1448 TSval=3528874695 TSecr=937282330"
"435","21.397966282","10.0.0.1","10.0.0.2","TCP","1514","34382  >  34567 [ACK] Seq=492321 Ack=1 Win=42496 Len=1448 TSval=3528874695 TSecr=937282330"
"436","21.410046186","10.0.0.1","10.0.0.2","TCP","1514","34382  >  34567 [ACK] Seq=493769 Ack=1 Win=42496 Len=1448 TSval=3528874695 TSecr=937282330"
"437","21.548394838","10.0.0.2","10.0.0.1","TCP","66","34567  >  34382 [ACK] Seq=1 Ack=493769 Win=207872 Len=0 TSval=937282556 TSecr=3528874695"
"438","21.622784118","10.0.0.1","10.0.0.2","TCP","2962","34382  >  34567 [PSH, ACK] Seq=495217 Ack=1 Win=42496 Len=2896 TSval=3528874919 TSecr=937282556"
"439","21.635280503","10.0.0.2","10.0.0.1","TCP","66","34567  >  34382 [ACK] Seq=1 Ack=495217 Win=208896 Len=0 TSval=937282643 TSecr=3528874695"
"440","21.709809043","10.0.0.1","10.0.0.2","TCP","2962","34382  >  34567 [PSH, ACK] Seq=498113 Ack=1 Win=42496 Len=2896 TSval=3528875006 TSecr=937282643"
"441","21.774009157","10.0.0.2","10.0.0.1","TCP","66","34567  >  34382 [ACK] Seq=1 Ack=498113 Win=208896 Len=0 TSval=937282781 TSecr=3528874919"
"442","21.848692793","10.0.0.1","10.0.0.2","TCP","2962","34382  >  34567 [PSH, ACK] Seq=501009 Ack=1 Win=42496 Len=2896 TSval=3528875145 TSecr=937282781"
"443","21.860541185","10.0.0.2","10.0.0.1","TCP","66","34567  >  34382 [ACK] Seq=1 Ack=501009 Win=208896 Len=0 TSval=937282868 TSecr=3528875006"
"444","21.922853151","10.0.0.1","10.0.0.2","TCP","1514","[TCP Previous segment not captured] 34382  >  34567 [ACK] Seq=506801 Ack=1 Win=42496 Len=1448 TSval=3528875232 TSecr=937282868"
"445","22.001656617","10.0.0.2","10.0.0.1","TCP","66","34567  >  34382 [ACK] Seq=1 Ack=503905 Win=208896 Len=0 TSval=937283007 TSecr=3528875145"
"446","22.074479698","10.0.0.1","10.0.0.2","TCP","2639","34382  >  34567 [PSH, ACK] Seq=508249 Ack=1 Win=42496 Len=2573 TSval=3528875373 TSecr=937283007"
"447","22.074490949","10.0.0.2","10.0.0.1","TCP","78","[TCP Dup ACK 445#1] 34567  >  34382 [ACK] Seq=1 Ack=503905 Win=208896 Len=0 TSval=937283081 TSecr=3528875145 SLE=506801 SRE=508249"
"448","22.198370593","10.0.0.1","10.0.0.2","TCP","1514","[TCP Out-Of-Order] 34382  >  34567 [ACK] Seq=503905 Ack=1 Win=42496 Len=1448 TSval=3528875506 TSecr=937283081"
"449","22.226519451","10.0.0.2","10.0.0.1","TCP","78","[TCP Dup ACK 445#2] 34567  >  34382 [ACK] Seq=1 Ack=503905 Win=208896 Len=0 TSval=937283233 TSecr=3528875145 SLE=506801 SRE=510822"
"450","22.289773840","10.0.0.1","10.0.0.2","TCP","1514","[TCP Retransmission] 34382  >  34567 [ACK] Seq=505353 Ack=1 Win=42496 Len=1448 TSval=3528875597 TSecr=937283233"
"451","22.350091350","10.0.0.2","10.0.0.1","TCP","78","34567  >  34382 [ACK] Seq=1 Ack=505353 Win=207872 Len=0 TSval=937283357 TSecr=3528875506 SLE=506801 SRE=510822"
"452","22.442136980","10.0.0.2","10.0.0.1","TCP","66","34567  >  34382 [ACK] Seq=1 Ack=510822 Win=205312 Len=0 TSval=937283449 TSecr=3528875597"
